collection,date,id,title,topic_score
kissinger,1974-03-14 00:00:00,0000C49F,Telecon with Wayne Hayes and Kissinger 9:29 A.M.,0.101449
kissinger,1976-05-11 11:50:00,0000D77A,TELECON WITH AMBASSADOR DOBRYNIN AT 11:50 A.M.,0.0916026
kissinger,1975-10-13 22:15:00,0000BC92,Telecon with Sonnenfeldt and the Secretary AT 10:15 P.M.,0.08642
kissinger,1975-04-05 19:05:00,0000BC2E,TELECON WITH HARRIMAN AT 7:05 P.M.,0.0821919
kissinger,1974-12-10 16:33:00,0000D7A6,TELECON WITH VICE PRESIDENT ROCKEFELLER AT 4:33 P.M.,0.068027
kissinger,1976-03-17 12:35:00,0000BE11,Telecon with Kissinger and Ted Koppel AT 12:35 P.M.,0.0666669
kissinger,1975-01-07 21:50:00,0000BB0D,TELECON WITH ROY ATHERTON AT 9:50 P.M.,0.0660796
kissinger,1975-04-10 17:00:00,0000D85D,TELECON WITH AMBASSADOR DOBRYNIN AT 5:00 P.M.,0.0628576
kissinger,1976-03-27 17:30:00,0000BF4F,TELECON WITH DINITZ/SEC KISSINGER AT 5:30 P.M.,0.0612246
kissinger,1974-08-17 00:00:00,0000C1EC,Telecon with Dobrynin and Kissinger,0.0601854
kissinger,1975-01-18 08:05:00,0000BB3C,TELECON WITH WELLS STABLER AT 8:05 A.M.,0.0573769
kissinger,1974-03-07 12:45:00,0000C474,Telecon with Hartman and Kissinger at 12:45 P.M.,0.0571432
kissinger,1974-01-30 09:50:00,0000C677,Telecon with Kissinger and Art Hummel at 9:50 A.M.,0.0569619
kissinger,1974-01-09 09:19:00,0000D9BA,TELECON WITH AMBASSADOR CROMER AT 9:19 A.M.,0.05691
kissinger,1974-02-20 00:00:00,0000C45B,Telecon with Kissinger and Javits,0.0569086
kissinger,1974-01-24 18:45:00,0000C660,Telecon with Kissinger and Dobrynin at 6:45 P.M.,0.0563382
kissinger,1975-05-09 17:22:00,0000BF9E,Telecon with Sonnenfeldt and the Secretary AT 5:22 P.M.,0.0551182
kissinger,1975-12-22 17:20:00,0000DA49,TELECON WITH ROBERT ELLSWORTH AT 5:20 P.M.,0.0545456
kissinger,1975-09-20 14:50:00,0000BF04,TELECON WITH AMB. DINITZ/SEC. KISSINGER AT 2:50 P.M.,0.0538924
kissinger,1976-03-27 17:40:00,0000BF4E,TELECON WITH AMB. DINITZ/SEC KISSINGER AT 5:40 P.M.,0.0522878
kissinger,1973-10-24 16:25:00,0000C856,TELECON WITH SEC SCHLESINGER - SECRETARY KISSINGER AT 4:25 P,0.0521739
kissinger,1974-08-23 10:22:00,0000D645,TELECON WITH DOBRYNIN AT 10:22 A.M.,0.0512544
kissinger,1975-01-29 19:25:00,0000BB53,TELECON WITH ARTHUR HARTMAN AT 7:25 P.M.,0.0502796
kissinger,1976-01-16 19:45:00,0000BD65,Telecon with Funseth and Kissinger AT 7:45 P.M.,0.05
kissinger,1975-10-10 09:07:00,0000D8A8,TELECON WITH MR. SONNENFELDT AT 9:07 A.M.,0.0492959
kissinger,1975-04-23 12:55:00,0000BC1A,TELECON WITH STROM THURMOND AT 12:55 P.M.,0.0491802
kissinger,1974-08-17 14:47:00,0000D697,TELECON WITH THE SECRETARY AT 2:47 P.M.,0.0481945
kissinger,1974-08-19 08:21:00,0000BA62,TELECON WITH CLERIDES AT 8:21 A.M.,0.0481287
kissinger,1975-05-06 18:32:00,0000BF8F,Telecon with Dobrynin and the Secretary AT 6:32 P.M.,0.0479999
kissinger,1974-02-14 15:30:00,0000C418,TELECON WITH SECRETARY KISSINGER - GENERAL HAIG AT 3:30 P.M.,0.0469804
kissinger,1974-03-13 12:50:00,0000C499,Telecon with FM Rabasa and Kissinger at 12:50 P.M.,0.0466324
kissinger,1975-10-09 18:06:00,0000BC79,Telecon with Sonnenfeldt and the Secretary AT 6:06 P.M.,0.0461539
kissinger,1976-12-06 15:45:00,0000C15A,TELECON WITH AMB. DINITZ/SEC KISSINGER AT 3:45 P.M.,0.0457519
kissinger,1976-01-09 12:55:00,0000BD4C,Telecon with Kissinger and Alan Cranston AT 12:55 P.M.,0.0454546
kissinger,1974-02-08 11:10:00,0000C6AE,Telecon with John McCloy and Kissinger at 11:10 A.M.,0.0447763
kissinger,1974-06-08 11:05:00,0000C9B9,TELECON WITH HAL SONNENFELDT/SECRETARY KISSINGER AT 11:05 A.,0.0444447
kissinger,1974-06-08 11:15:00,0000C9BA,TELECON WITH THE PRESIDENT/SECRETARY KISSINGER AT 11:15 A.M.,0.0439564
kissinger,1976-10-15 10:20:00,0000DA35,TELECON WITH SECRETARY SIMON AT 10:20 A.M.,0.0437958
kissinger,1975-09-19 14:15:00,0000BE4A,TELECON WITH TED KOPPEL/SEC. KISSINGER AT 2:15 P.M.,0.0434784
kissinger,1975-06-26 18:54:00,0000C07B,Telecon with Goodell and the Secretary AT 6:54 P.M.,0.0431669
kissinger,1976-01-14 16:45:00,0000BE24,Telecon with Ted Koppel and Kissinger AT 4:45 P.M.,0.0431034
kissinger,1976-07-26 18:37:00,0000BE98,Telecon with the Secretary and Habib AT 6:37 P.M.,0.0428566
kissinger,1975-11-21 14:55:00,0000D8DC,TELECON WITH AMBASSADOR DINITZ AT 2:55 P.M.,0.0427361
kissinger,1974-02-12 00:00:00,0000C43A,TELECON WITH SECRETARY KISSINGER/THE PRESIDENT,0.0419164
kissinger,1975-06-05 12:21:00,0000D7FE,TELECON WITH SENATOR JAVITS AT 12:21 P.M.,0.0416666
kissinger,1974-12-10 08:50:00,0000D7A5,"TELECON WITH JOHN OSBORNE, THE NEW REPUBLIC AT 8:50 A.M.",0.041408
kissinger,1976-11-19 15:26:00,0000C12D,TELECON WITH AMB DOBRYNIN/SEC KISSINGER AT 3:26 P.M.,0.0406505
kissinger,1976-11-11 18:30:00,0000C113,TELECON WITH DON KENDALL/THE SECRETARY AT 6:30 P.M.,0.0403226
kissinger,1975-02-06 10:58:00,0000BB88,TELECON WITH PHIL HABIB AT 10:58 A.M.,0.0400001
kissinger,1974-07-20 11:20:00,0000CA16,TELECON WITH INGERSOLL/BUFFUM/HAK AT 11:20 A.M.,0.0395482
kissinger,1975-11-13 14:45:00,0000BCE0,Telecon with Palme and the Secretary AT 2:45 P.M.,0.0390243
kissinger,1975-09-20 11:10:00,0000BE5E,TELECON WITH MR. ATHERTON/SEC. KISSINGER AT 11:10 A.M.,0.0384616
kissinger,1975-06-05 09:45:00,0000DA25,TELECON WITH MR. ARTHUR BURNS AT 9:45 A.M.,0.0381682
kissinger,1974-06-21 00:00:00,0000C9C2,TELECON WITH SENATOR TAFT/SECRETARY KISSINGER AT 11:02,0.0380431
kissinger,1974-01-09 14:40:00,0000C632,Telecon with Pell and Kissinger at 2:40 P.M.,0.0378781
kissinger,1974-03-22 00:00:00,0000C4ED,Telecon with Sonnenfeldt and Kissinger at4:35 P.M.,0.0375946
kissinger,1975-11-04 15:15:00,0000DA5D,TELECON WITH JOE DRAFT AT 3:15 P.M.,0.0368424
kissinger,1974-12-14 10:24:00,0000BADF,TELECON WITH HUMPHREY AT 10:24 A.M.,0.0367649
kissinger,1973-10-26 19:55:00,0000C8A4,TELECON WITH HAIG/KISSINGER AT 7:55 P.M.,0.0359713
kissinger,1974-07-26 12:55:00,0000CA37,TELECON WITH JOHN NEWHOUSE/KISSINGER AT 12:55 P.M.,0.0354611
kissinger,1976-02-06 11:50:00,0000BE34,Telecon with Kissinger and Robert Kleiman AT 11:50 A.M.,0.034483
kissinger,1976-09-14 00:00:00,0000D9D4,TELECON WITH FM CROSLAND AT 9:?45 A.M.,0.0343351
kissinger,1975-02-01 16:12:00,0000D7D7,TELECON WITH SENATOR JAVITS AT 4:12 P.M.,0.0342862
kissinger,1976-10-04 00:00:00,0000D940,TELECON WITH KISSINGER/MEXICAN AMBASSADOR OLLOQUI AT 12:58PM,0.0330584
kissinger,1976-07-14 18:05:00,0000BE76,Telecon with the Secretary and Kosciusko-Morizet AT 6:05 P.M,0.0330577
kissinger,1976-08-17 00:00:00,0000D912,TELECON WITH KISSINGER/MR MARVIN KALB AT 10:50AM,0.0330577
kissinger,1974-08-12 10:37:00,0000D99F,TELECON WITHAMBASSADOR DOBRYNIN  AT 10:37 A.M.,0.0327869
kissinger,1974-02-02 09:50:00,0000C695,Telecon with Sclesinger and Kissinger at 9:50 A.M.,0.0326798
kissinger,1973-10-06 18:20:00,0000C229,TELECON WITH AMBASSADOR DOBRYNIN/SECRETARY KISSINGER AT 6:20,0.0325204
kissinger,1974-01-23 22:00:00,0000C65D,Telecon with Len Garment and Kissinger at 10:00 P.M.,0.0322581
kissinger,1973-10-13 15:35:00,0000C75A,TELECON WITH SIR ALEC DOUGLAS-HOME - SECRETARY KISSINGER AT ,0.0317462
kissinger,1973-10-30 16:30:00,0000C8EE,TELECON WITH LORD CROMER - SECRETARY KISSINGER AT 4:30 P.M.,0.0317461
kissinger,1973-03-21 12:57:00,0000C4DE,Telecon with Dobrynin and Kissinger at 12:57 P.M.,0.0310079
kissinger,1973-10-25 19:19:00,0000C884,TELECON WITH HAIG/KISSINGER AT 7:19 P.M.,0.0310078
kissinger,1976-05-13 09:45:00,0000D77E,TELECON WITH SONNENFELDT AT 9:45 A.M.,0.0307692
kissinger,1976-11-10 15:50:00,0000C10E,TELECON WITH MARVIN KALB/SEC KISSINGER AT 3:50 P.M.,0.0298509
kissinger,1974-02-11 00:00:00,0000C6BC,Telecon with President Nixon and Kissinger,0.0298508
kissinger,1976-04-15 15:00:00,0000DA51,TELECON WITH MR. EDWIN YEO AT 3:00 P.M.,0.0289259
kissinger,1974-01-23 21:45:00,0000C65C,Telecon with Kissinger and Jackson at 9:45 P.M.,0.0281691
kissinger,1976-12-04 12:15:00,0000C137,TELECON WITH AMB. DOBRYNIN/THE SECRETARY AT 12:15 P.M.,0.0275229
kissinger,1974-07-24 00:00:00,0000CA36,TELECON WITH FRENCH FM SAUVAGNARGUES/SECRETARY KISSINGER AT ,0.025641
kissinger,1973-10-23 20:00:00,0000C83C,TELECON WITH HAIG/KISSINGER AT 8:00 P.M.,0.0241938
