collection,date,id,title,topic_score
kissinger,1975-10-16 12:03:00,0000BC97,Telecon with Kissinger and Butz AT 12:03 P.M.,0.125605
kissinger,1973-11-01 00:00:00,0000C902,TELECON WITH AMBASSADOR DOBRYNIN/SECRETARY KISSINGER AT 3:30,0.083799
kissinger,1973-11-01 00:00:00,0000C1AC,Telecon with Dobrynin and Kissinger at 3:30,0.0828731
kissinger,1975-04-03 11:22:00,0000D888,TELECON WITH PRESIDENT FORD (FROM CALIFORNIA) AT 11:22 A.M.,0.0794702
kissinger,1975-07-24 14:50:00,0000BD69,TELECON WITH SEC. BUTZ/SEC. KISSINGER AT 2:50 P.M.,0.0744687
kissinger,1975-09-19 14:00:00,0000BE47,TELECON WITH AMBASSADOR DINITZ/SECRETARY KISSINGER AT 2:00 P,0.0615387
kissinger,1974-10-04 09:58:00,0000C97E,TELECON WITH DOBRYNIN AT 9:58 A.M.,0.0606059
kissinger,1974-10-04 00:00:00,0000D9A4,TELECON WITH AMBASSADOR DOBRYNIN AT 3:05 P.M,0.059575
kissinger,1974-03-13 15:00:00,0000DA40,TELECON WITH IVAN HEAD AT 3:00 P.M.,0.0585805
kissinger,1974-06-05 09:25:00,0000C993,TELECON WITH MR. MCNAMARA/SECRETARY KISSSINGER AT 9:25 A.M.,0.0584416
kissinger,1976-04-02 19:37:00,0000BF69,TELECON WITH MINISTER VORONTSOV/SECRETARY KISSINGER AT 7:37 ,0.0545458
kissinger,1973-10-09 01:45:00,0000C279,TELECON WITH AMB DINITZ (ISRAEL)/SEC. KISSINGER (AT HOME) AT,0.0522391
kissinger,1975-01-10 19:20:00,0000D7B5,TELECON WITH ENDERS AT 7:20 P.M.,0.0518519
kissinger,1976-03-24 18:45:00,0000D6D9,TELECON WITH AMBASSADOR RAMSBOTHAM AT 6:45 P.M.,0.0500002
kissinger,1973-10-07 00:00:00,0000C24A,TELECON WITH CROMER/KISSINGER AT 4:25,0.0496452
kissinger,1975-10-09 16:45:00,0000D8E5,TELECON WITH ABMASSADOR DINITZ AT 4:45 P.M.,0.0489569
kissinger,1974-12-03 15:20:00,0000D79F,TELECON WITH SENATOR BARR GOLDWATER AT 3:20 P.M.,0.0480001
kissinger,1973-10-25 14:50:00,0000C87A,TELECON WITH JOE KRAFT/SECRETARY KISSINGER AT 2:50 P.M.,0.0479449
kissinger,1973-10-02 09:50:00,0000C1F2,TELECON WITH WARRE/SEC KISSINGER AT 9:50 A.M.,0.0465117
kissinger,1974-12-23 09:35:00,0000D7CD,TELECON WITH RUMSFELD AT 9:35 A.M.,0.046154
kissinger,1976-08-03 12:29:00,0000BEAF,Telecon with Frank Zarb and Kissinger AT 12:29 P.M.,0.0461538
kissinger,1975-04-14 15:20:00,0000D893,TELECON WITH MR. SCHECTER AT 3:20 P.M.,0.0452962
kissinger,1974-04-23 16:45:00,0000C547,Telecon with Dinitz and Kissinger at 4:45 P.M.,0.0444438
kissinger,1973-12-31 10:40:00,0000C5F6,Telecon with Kissinger and Bob Pierpoint at 10:40 A.M.,0.0437957
kissinger,1976-08-21 09:31:00,0000CF73,TELECON WITH MR. YEO/SECRETARY KISSINGER AT 9:31 A.M.,0.0434787
kissinger,1975-01-17 16:25:00,0000BB39,TELECON WITH RHODES AT 4:25 P.M.,0.0431654
kissinger,1975-01-17 12:20:00,0000D7BE,TELECON WITH BRUCE VAN VOORST AT 12:20 P.M.,0.0426837
kissinger,1974-04-27 15:35:00,0000C56C,Telecon with Dinitz and Kissinger at 3:35 P.M.,0.0423166
kissinger,1975-04-22 00:00:00,0000D872,TELECON WITH MR. SCHECTER AT 5:50  P.M.,0.0422537
kissinger,1974-08-19 20:03:00,0000D63C,TELECON WITH CONG. ZABLOCKI AT 8:03 P.M.,0.0422527
kissinger,1973-11-30 16:12:00,0000D9B8,TELECON WITH LORD CORMER AT 4:12 P.M.,0.0420162
kissinger,1973-10-13 00:00:00,0000C73C,TELECON WITH SECRETARY KISSINGER/AMBASSADOR DINITZ AT 12:32,0.0419163
kissinger,1976-03-15 15:10:00,0000D72C,TELECON WITH AMB. DINITZ AT 3:10 P.M.,0.0412364
kissinger,1974-07-19 12:45:00,0000CA00,TELECON WITH SECRETARY KISSINGER/AMB MCCLOSKEY AT 12:45 P.M.,0.0409839
kissinger,1975-02-07 17:19:00,0000BB8E,TELECON WITH BUTZ AT 5:19 P.M.,0.0406504
kissinger,1974-03-14 22:40:00,0000C4A8,Telecon with Barry Schweid and Kissinger at 10:40 P.M.,0.0403226
kissinger,1976-08-23 00:00:00,0000D9E3,TELECON WITH KISSINGER/AMBASSADOR RICHARDS AT 9:05AM,0.0402683
kissinger,1975-10-13 22:23:00,0000D9AF,TELECON WITH AMBASSADOR DOBRYNIN AT 10:23 P.M.,0.040161
kissinger,1975-11-26 12:37:00,0000BD08,Telecon with Eric Severeid and the Secretary AT 12:37 P.M.,0.0397352
kissinger,1976-06-15 15:15:00,0000C031,TELECON WITH MR. SONNENFELDT/SEC KISSINGER AT 3:15 P.M.,0.0394755
kissinger,1975-07-19 00:15:00,0000D95E,TELECON WITH AMBASSADOR DINITZ AT 12:15 A.M.,0.039165
kissinger,1973-10-12 14:30:00,0000C6E8,TELECON WITH SENATOR HUMPHREY - SECRETARY KISSINGER AT 2:30 ,0.0390625
kissinger,1975-02-22 00:00:00,0000D83E,TELECON WITH SENATOR JAVITS AT 12:00 NOON,0.0386477
kissinger,1975-10-09 18:06:00,0000BC79,Telecon with Sonnenfeldt and the Secretary AT 6:06 P.M.,0.0384614
kissinger,1976-03-03 17:19:00,0000BDA8,Telecon with Eagleburger and Kissinger AT 5:19 P.M.,0.037594
kissinger,1974-07-20 09:55:00,0000CA14,TELECON WITH INGERSOLL/HAK AT 9:55 A.M.,0.037037
kissinger,1973-10-10 20:27:00,0000C291,TELECON WITH SECRETARY GENERAL WALDHEIM/SECRETARY KISSINGER ,0.0370369
kissinger,1975-04-10 10:37:00,0000BBF0,TELECON WITH BILL ROGERS AT 10:37 A.M.,0.0359282
kissinger,1973-10-09 19:25:00,0000C27F,TELECON WITH AMBASSADOR DINITZ - SECRETARY KISSINGER AT 7:25,0.0352113
kissinger,1976-06-17 16:40:00,0000C06C,TELECON WITH MR. SONNENFELDT/SECRETARY KISSINGER AT 4:40 P.M,0.0350878
kissinger,1973-10-11 19:55:00,0000C2AA,TELECON WITH SCOWCROFT/KISSINGER AT 7:55 P.M.,0.0347826
kissinger,1975-07-21 19:48:00,0000C956,TELECON WITH SHALEV AT 7:48 P.M.,0.0341883
kissinger,1975-05-18 14:20:00,0000D7FD,TELECON WITH SENATOR JAVITS AT 2:20 P.M.,0.0341301
kissinger,1974-03-06 21:30:00,0000C472,Telecon with Scowcroft and Kissinger AT 9:30 P.M.,0.0338983
kissinger,1976-05-10 17:15:00,0000D774,TELECON WITH MR. JOHN CONNOLLY AT 5:15 P.M.,0.0337839
kissinger,1974-08-03 09:55:00,0000CA67,TELECON WITH GENERAL HAIG/THE SECRETARY AT 9:55 A.M.,0.0327861
kissinger,1973-10-07 16:40:00,0000C24B,TELECON WITH DOBRYNIN/KISSINGER AT 4:40 P.M.,0.0325203
kissinger,1975-10-29 14:20:00,0000BCB1,Telecon with Ted Koppel and Kissinger AT 2:20 P.M.,0.0324677
kissinger,1973-01-10 11:10:00,0000C636,Telecon with Donald Kendall and Kissinger at 11:10 A.M.,0.032
kissinger,1973-10-25 19:15:00,0000C883,TELECON WITH THE PRESIDENT/KISSINGER AT 7:15 P.M.,0.0317462
kissinger,1974-07-20 13:31:00,0000CA1A,TELECON WITH MCCONE/HAK AT 1:31 P.M.,0.0317462
kissinger,1975-02-05 18:36:00,0000BB66,TELECON WITH SCHLESINGER AT 6:36 P.M.,0.0317461
kissinger,1975-04-28 22:45:00,0000D7E2,TELECON WITH THE PRESIDENT AT 10:45 P.M.,0.0312501
kissinger,1973-10-02 15:30:00,0000C1F7,TELECON WITH STOESSEL/KISSINGER AT 3:30 P.M.,0.0305343
kissinger,1976-03-19 15:15:00,0000DA4C,TELECON WITH DEPUTY SECRETARY CLEMENTS AT 3:15 P.M.,0.029412
kissinger,1975-03-31 20:55:00,0000BBDF,TELECON WITH JOE SISCO AT 8:55 P.M.,0.0291965
kissinger,1975-04-29 00:00:00,0000BF68,Telecon with Phil Habib and Kissinger AT MIDNIGHT,0.0252101
kissinger,1976-03-03 14:50:00,0000BE44,Telecon with Kissinger and Don Kendall AT 2:50 P.M.,0.0173912
