collection,date,id,title,topic_score
ddrs,1960-09-26,1998090102666,"Memorandum by John S.D. Eisenhower regarding a meeting between President Eisenhower, India\'s Prime Minister Nehru, Foreign Secretary Dutt, Secretary Herter, Assistant Secretary Jones, and Col. Eisenhower. Topics include: Khrushchev\'s verbal attack on the UN; proposal to move the UN building to West Berlin; Congo; agreement between India and Pakistan; China.",0.0803922
ddrs,1972-07-13,2005010100515,"Text of a 10:03 a.m. telephone conversation between Henry Kissinger and Ray Caldero regarding insinuating statements made by actress Terry Moore that she and Kissinger were \""more than friends.\"" Kissinger met once with Moore after she called and offered to",0.0803803
ddrs,,2009070102242,Report on accusations of improper use of campaign finances by the Nixon administration during the 1968 and 1972 presidential elections.,0.0803523
ddrs,1956-04-03,1989110103546,"WH conference with Eisenhower, Admiral Radford, Air Chief Marshal Dickson, and Lt. General Whiteley on the Middle East.",0.0802923
ddrs,1964-03-27,2010090102654,"U.S. Ambassador Chester Bowles relates Indian Ambassador Braj Kumar (B.K.) Nehru\'s description of his difficulties in Washington, D.C. which include: not being able to obtain access to President Lyndon B. Johnson; not feeling at ease with members of Congress; inadequacy of the Indian public relations staff; American lack of understanding of India\'s problems and interests.",0.0802487
ddrs,1966-09-16,1993010100586,Information campaign publicizing private U.S. assistance to Vietnam described.,0.0797352
ddrs,1987-01-11,2009010100199,Summary of Assistant Secretary of State Richard Murphy\'s discussion with Jordanian King Hussein and Prime Minister Zeid Sameer Rifa\'i on the status of the latest battles between Iran and Iraq.,0.0796989
ddrs,1964-06-26,1975100100045,"Indian Prime Minister Shastri, The People Around [immediate political associates will exercise more influence; the Congress Party background: the Kamaraj Plan; Shastri\'s relationship with party bosses; the inner cabinet; the president]. Office of Current Intelligence, Special Report, SC No. 00625/64A. June 26, 1964. 11 p. SECRET/NO FOREIGN DISSEM. Declassified Nov. 4, 1975.",0.0796764
ddrs,1953-02-06,1998110103409,"A study on the implementation of a U.S. political warfare campaign against the U.S.S.R. Study results include: rivalry between Soviet political personalities; differing economic theories; conflict between \""old and new\"" Bolsheviks; Soviet armed forces.",0.0789556
ddrs,1964-04-25,2002070101897,Cable regarding a Colombian military commitment to campaign against rebel leader Manuel Marulanda. The Communist Party in Colombia supports Marulanda.,0.0788927
ddrs,1966-05-09,1988110103289,Analysis of upcoming presidential election.,0.0785278
ddrs,1965-06-29,2001050101570,Secretary of State Dean Rusk and Australian Foreign Minister Paul Hasluck discuss the value of public opinion upon the success of U.S. and Australian policies toward Vietnam.,0.0782619
ddrs,1964-01-07,1975100100037,"Prime Minister Nehru\'s Health [deteriorating]. Intelligence Information Cable, TDCS-3/569,380. Jan. 7, 1964. 2 p. Security classification not given. SANITIZED copy. Released Nov. 12, 1975.",0.0781078
ddrs,1965-06-29,1998090102781,"Meeting to discuss the situation in Vietnam. Participants include: Secretary of State DeanRusk; Australian Minister for External Affairs Paul M.C. Hasluck; J. Keith Waller, Australian Ambassador; William P. Bundy, Assistant Secretary of State for Far Eastern Affairs; Thomas F. Conlan. Topics include: long-term objectives in Vietnam; military situation; internal situation in South Vietnam.",0.077923
ddrs,1976-01-14,1984010100089,Senate Select Committee requests data on assets and outlets in certain media categories.,0.0777811
ddrs,1964-04-25,2002010100085,Cable regarding a U.S. evaluation as to Colombia\'s need for three additional helicopters and three L-20 aircraft for its campaign against the South Tolima-North Huila Communist area of Marquetalia (southern Colombia).,0.0776275
ddrs,1956-12-16,1985010100119,"Dulles reports on conversation with Indian Prime Minister Nehru at Blair House, topics include: 10 Americans imprisoned in Communist China; attack on Egypt; Baghdad Pact.",0.0774194
ddrs,1953-01-16,1999030101152,Memorandum from Edmond L. Taylor to George Morgan on the need for Psychological Strategy Board action to exploit communist antisemitism and other so-called purges.,0.0771284
ddrs,1968-06-03,2003070102158,"Federal Bureau of Investigation (FBI) director J. Edgar Hoover provides President Lyndon B. Johnson with information on the Poor People\'s Campaign (Dr. Martin Luther King, Jr.\'s project to promote jobs and increase income for Blacks living in U.S. ghettos).",0.0764389
ddrs,1958-07-19,1987030100773,Ambassador Bunker explains to Indian President Nehru reasons for United States action in Lebanon.,0.0764334
ddrs,1965-05-26,1998070101908,Intelligence memorandumreport No. 242 on the Imbert government\'s efforts to be recognized as the legitimate Dominican government.,0.0761955
