collection,date,id,title,topic_score
ddrs,1972-03-17,2007030100960,"White House fact sheet concerning President Richard M. Nixon\'s proposed bills which include the \""Student Transportation Moratorium Act of 1972\"" and the \""Equal Educational Opportunities Act of 1972.\""",0.125499
ddrs,1967-11-14,2005090102788,Federal Bureau of Investigation (FBI) director J. Edgar Hoover provides White House staff member Mildred Stegall with information on selected racial developments throughout the U.S. Issues include: student disturbance at Central State University in Wilber,0.125268
ddrs,1967-10-25,2008030100918,"Federal Bureau of Investigation (FBI) director J. Edgar Hoover provides White House staff member Mildred Stegall with information on select racial developments throughout the U.S. Issues include: continuation of racial demonstrations in Birmingham, Alabama; school disturbances in Waukegan, Maywood, and Lockport, Illinois, Niagara Falls, New York, and Los Angeles, California.",0.124195
ddrs,1969-01-17,1980070100267,"Student Unrest Study Group, Report of the. Information Memorandum, George McGhee, Amb. at Large, to the Secy of State. Jan. 17, 1969. 2 p. Att: (1) Impressions concerning International Student Unrest [investigation of whether student unrest can be isolated from a more general unrest or from the problems applying more generally to youth, whether it is a local phenomenon or occurs in response to international issues, whether it is under Communist control or influenced by attitudes \""indicative of a historical turning point,\"" whether the movement can be regarded as constructive, and whether any characteristics of the movement distinguish it from earlier disturbances; suggested lines of action for US embassies]. Report, Student Unrest Study Group. 20 p.; Encl: Motivations of Student Unrest [in the Congos, Ethiopia, Ghana, Morocco, Senegal, South Africa, Sudan, Tunisia, Hong Kong, Indonesia, Japan, Philippines, Belgium, Czechoslovakia, France, Germany, Italy, Spain, Sweden, Yugoslavia, Bolivia, Brazil, Colombia, Guatemala, Mexico, Peru, Uruguay, India, Pakistan, Turkey, and the UAR]. 11 p. CONFIDENTIAL. Declassified Aug. 18, 1979.",0.123357
ddrs,1956-06-27,1989030100764,President Castillo\'s actions to meet subversive threat among students and leftists which he asserts is inspired and activated by Communists discussed.,0.12329
ddrs,1970-10-01,2009070102270,"Report by Cabinet Committee on Education assistant director Frank Williams entitled: \""Aid to Displaced Black Educators.\"" This document details the availability of federal resources to aid displaced Black educators in public schools throughout the South, who have lost their positions as a result of desegregation legislation.",0.123123
ddrs,1959-01-01,1984010102361,"Biography of Bernardo Houssay, Nobel Prize winner for Medicine in 1947.",0.122803
ddrs,,2007110103482,"Draft response from President Richard M. Nixon to a 4/6/71 letter (attached) to him from student members of the Kent State University \""Daily Kent Stater\"" newspaper in which they pose questions concerning Nixon administration policies now in place to prevent another tragedy such as the 5/4/70 killings of four Kent State students by Ohio National Guardsmen during an anti-Vietnam War demonstration on university grounds.",0.122746
ddrs,1964-09-08,1980010100244,"[Haiti. Barring the arrival of new rebels and supplies, the present rebel situation appears to be under control. The rebels did not have enough men to seize an important military objective and confront the militarily superior Haitian forces. Peasant sympathy was not forthcoming, and no incidents of sabotage or defections occurred in the capital. \""Time beginning to run in Duvalier\'s favor.\""] Am Emb Port-au-Prince, Telegram No. 507. Sept. 8, 1964. 3 p. CONFIDENTIAL. Declassified Apr. 18, 1979. Johnson Library, NSF, Countries, Haiti, Vol. 4.",0.122531
ddrs,1969-02-01,2005110103337,"Federal Bureau of Investigation (FBI) director J. Edgar Hoover provides White House staff member Mildred Stegall with information on selected racial developments throughout the U.S. Issues include: continuation of a Dayton, Ohio, protest vigil against the",0.122201
