collection,date,id,title,topic_score
ddrs,1951-08-03,1975010100069,"Enemy Materiel [Korean War: Ch. I: Problems presented by the North Korean People\'s Army in Korean Campaign; Ch. II: Problems Presented by the Chinese Entry into the Korean Campaign; Ch. III: Changes in Proportions of National Makes of Equipment in the Enemy\'s Hands; Ch. IV: Specific Problems Encountered by Individual Enemy Weapons; Ch. V: Chinese and North Korean Copies of Foreign Weapons and Ammunition; Ch. VI: Problems Encountered by Enemy Equipment, Other than Weapons]. Monograph. Headquarters Eighth United States Army Korea [EUSAK] Aug. 3, 1951. 70 p. il. diag. Citations. Appendices 1-7. 130 p. SECRET, downgraded to CONFIDENTIAL. Declassified 1973.",0.306833
ddrs,1974-08-22,2009110103251,"Information on recent developments in the Kurdistan Region which calls for economic aid in the form of financial grants for the care of refugees, and military assistance to the Kurds in their fight against Iraqi aggression.",0.255953
ddrs,1967-10-03,2003110103186,Background paper in preparation for the U.S. visit of Ghanaian National Liberation chairman General Joseph Ankrah regarding Ghana\'s offer of Soviet military equipment to the U.S. This material had been sold to Ghana by the Soviet Union for use by deposed President Kwame Nkrumah\'s guard regiment. Attached is a list of the types and quantities of weapons and equipment involved.,0.255107
ddrs,,1986013100129,Use of the Soviet 120-mm mortar in South Vietnam discussed.,0.247938
ddrs,,1999010100083,"Pictures of Soviet weapons systems. Weapons include: FROG 3, 4, 5 and 6warheads; T-34 medium tank; PT-76 amphibious tank. Characteristics and performance are given for the tanks and the FROG-6 warhead.",0.240679
ddrs,1953-02-27,1979040100076,"[Union of Soviet Socialist Republics] The Tank and Assault Gun Industry of the USSR [the Soviet tank and assault gun development from 1919 to 1952, which began as an adjunct to the auto and tractor industry and became a specialized industry of its own, is reviewed. Post-World War II developments can be divided into three phases: salvage and conversion to civilian production from 1945-47, utilization of refurbished plants and development of techniques learned during the war from 1947-49, and serial production of the T-54 medium tank, JS-III heavy tank, and corresponding assault guns from 1949 to the present. The high degree of centralization in the industry, where tank plants are in close proximity to other heavy equipment facilities and steel production plants, allows for quick conversion of all facilities to tank and gun production. The present tank inventory is 59,398 units. Full mobilization of Soviet forces would require 76,000 tanks. The deficit of 17,000 tanks could be manufactured by the six plants currently producing tanks at their 29,000 unit per-year rate with a substantial margin for combat losses]. Office of Research and Reports, Provisional Intelligence Report, CIA/RR PR-25. Feb. 27, 1953. 68 p., il. App: (A) Gaps in Intelligence. 1 p.; (B) Methodology. 1 p.; (C) Sources and Evaluation of Sources. 9 p. SECRET. SANITIZED copy. Released Apr. 21, 1979.",0.236735
ddrs,1952-01-03,1985070101661,Negoating paper on reaching agreement with the British on a standard caliber of small arms ammunition.,0.234248
ddrs,1965-08-14,2005050101459,Memorandum to Deputy Assistant Secretary of State William Handley from Deputy Assistant Secretary of State Rodger Davies regarding a public campaign to force a change in U.S. Middle East arms policy with respect to the sale of military equipment to Israel,0.228169
ddrs,1952-01-03,1987070102288,Briefing paper on small arms standardization in preparation for meeting between Truman and Churchill.,0.224116
ddrs,1990-05-01,2008110103290,Summary of additional elements of common ground at the Strategic Arms Reduction Talks II (START II) concerning the range threshold for Air-Launched Cruise Missiles (ALCMs).,0.223881
ddrs,1964-05-23,1976010100226,"Israel, Tanks for (C) (though superior in number and hardware, the Arabs trail Israel in quality of leadership. An increase in Israeli units does not seem justified. Israeli operations will be essentially defensive in nature). Memorandum, Lieut. Gen. Harold Israel, Tanks for (C) (though superior in number and hardware, (ISA). May 23, 1964. 3 p. Encl: (Comparison between the Centurion and the M4SA3.) 1 p. SECRET. Declassified Oct. 3, 1975. Johnson Library, NSF, Countries, Israel, Tanks, Vol. 1.",0.220856
ddrs,1951-10-09,1984010100005,Soviet military assistance to Albania detailed.,0.218694
ddrs,1967-09-17,1994010100092,"WH request for material bearing on the news article in the Sunday Star 9/67 by Peter Arnett, \""South Vietnam\'s Army found increasingly ineffective.\""",0.213734
ddrs,1982-05-12,2008050101324,Text of a statement by Associate Attorney General Rudolph Giuliani before the House Subcommittee on Crime concerning the threat posed to law enforcement and other officials by the availability of handgun ammunition capable of penetrating soft body armor.,0.207938
ddrs,1960-07-11,2001090102447,Colonel F.M. Norris reports to General A.J. Goodpastor on the types of U.S. tanks currently being used in South Korea by U.S. and South Korean armed forces.,0.201796
ddrs,,1979100100118,"RVNAF Force Levels FY 69-FY 70 [RVNAF should reach maximum possible strength of 801,215 troops by June 30, 1970]. Report. [Mar. 1968?] 2 p. Encl: (A) RVNAF Equipment Modernization [RVNAF should be fully equipped except for helicopters by July 1969]. 3 p.; (B) VC/NVA Forces [totalling 240 battalions]. 1 p. TOP SECRET to SECRET. Declassified Nov. 17, 1978. Johnson Library, NSF, NSC History, Mar. 31 Speech, Vol. 7.",0.19079
ddrs,,1992090102593,Latin American purchases of non-U.S. aircraft and naval vessels discussed.,0.190296
ddrs,1964-03-05,2006010100091,,0.183312
ddrs,1965-05-13,1981100100276,"[Haiti. There is considerable doubt that the group of dismissed army officers India and Pakistan in the Rann of Kutch [after a detailed examination of the merits of mutual Pakistani-Indian charges, it is concluded that both sides have apparently violated restrictions against using US equipment in the current war, although any violations have been minor in nature. At the core of determining what is a \""violation\"" is the problem of deciding which side is the \""aggressor\"" and thus violating the stricture against using US equipment in an \""aggressive\"" undertaking. A detailed breakdown of equipment previously supplied both countries is given]. Thomas Hughes, Dir., Bureau of Intelligence and Research, Research Memorandum, RNA-20, to the Acting Secy of State. May 13, 1965. 6 p. SECRET. NO FOREIGN DISSEM. Released June 14, 1978. Johnson Library, NSF, Countries, Pakistan, Vol. 3.",0.183242
ddrs,1967-06-09,2006110103234,Effects of the Department of State\'s (DOS) policy on control over the export of arms and ammunition sold to Israel and Arab countries. Included are the following lists: munitions articles shipped to select countries from 5/1 to 6/7/67; pending application for munitions list of exports to selected Middle East countries.,0.182773
ddrs,1990-05-25,2009030100907,Draft of basic provisions agreed to by the U.S. and the U.S.S.R. for a Strategic Arms Reduction Treaty (START).,0.181754
ddrs,1949-04-28,1978100100022,"[China, People\'s Republic of] Chinese Communist Army Has Reportedly Ousted consists of 210 mm guns for the Soviet Army; ammunition production is increasing, and Skoda is also developing new types of land mines and hand grenades. Factors limiting production of munitions are Soviet demands for heavy industrial production, shortages in materials, dislocation of industry, and Czech inability to make a final decision of types of munitions to be manufactured. The Czech munitions industry would be seriously crippled without Swedish iron ore, but the Swedish iron industry would not be notably curtailed by the loss of Polish coal and coke]. Intelligence Memorandum No. 170. Apr. 28, 1949. 3 p. App: (A) Skoda Production. 4 p.; (B) Skoda Capacity. 2 p.; (C) Dependence of Skoda on Swedish Iron. 2 p.; (D) Dependence of the Swedish Iron Industry on Polish Coal. 1 p. TOP SECRET. Declassified Apr. 21, 1978. Truman Library, Papers of Harry [China, People\'s Republic of] Chinese Communist Army Has Reportedly Ousted",0.181699
ddrs,1958-08-25,1991090102454,Outline for military assistance to 21 nations during Fiscal Year 1958 and 1959.,0.177488
ddrs,,1986070101845,Defense Intelligence Agency (DIA) summary on Viet Cong weapons.,0.175183
ddrs,1966-08-26,1985040100863,"Analysis of the Vietnamese Communists\' strengths, capabilities, and will to persist in their present strategy in Vietnam.",0.174194
ddrs,,2008050101325,"In a memorandum to Attorney General William French Smith, Associate Attorney General Rudolph Giuliani sets forth legislative options for dealing with the threat posed to law enforcement and other officials by the availability of handgun ammunition capable of penetrating soft body armor.",0.173601
ddrs,1956-02-27,1980070100163,"Near East, United States Objectives and Policies with Respect to the [the JCS approves for Iraq for FY 1950-55 amounted to $10.9 million; 60% was delivered by Nov. 1955. The 1956 program consisted of $1.5 million for ten Centurion tanks. Nine B-26\'s were sold to Saudi Arabia for $2,563,615]. Memorandum, Col. George Near East, United States Objectives and Policies with Respect to the [the JCS approves Capabilities of Arab States and Israel to Conduct Sustained Combat Operations [Arab capabilities would depend on their stockpiles if imports were cut off; they have weak supply, transport, and evacuation systems; they could sustain combat operations for thirty days. Israel is also dependent on outside military supplies but has an excellent logistic system and could sustain operations for ninety days. A breakdown of type and number of tanks, aircraft, and Soviet and US military equipment held by Syria, Lebanon, Jordan, Iraq, Egypt, Saudi Arabia, and Israel is given]. 11 p. SECRET. Declassified Sept. 1, 1978. Released 1979.",0.172733
ddrs,,2008010100101,"In a memorandum to Attorney General William French Smith, Associate Attorney General Rudolph Giuliani assesses the impact of legislation for the prevention of easy criminal access to armor-piercing handgun bullets.",0.169706
ddrs,1965-03-09,2005030100684,An estimate of the impact of a proposed U.S. military sales package to Jordan upon the Arab-Israeli arms balance. Also included are: Table I - Inventory of Middle East Armor; Table 2 - Inventory of Aircraft in the Middle East.,0.168942
ddrs,1970-04-30,2010090102891,,0.167402
ddrs,1963-12-27,1976100100041,"(United Kingdom) Britain\'s Economic Problems (detailed analysis of (has developed a highly specialized capability to support and maintain insurgency operations; new programs of standardization and modernization of equipment and political indoctrination of troops have been launched; military command and combat regions have been restructured). Office of Current Intelligence Special Report, SC No. 00624/63B. Dec. 27, 1963. 10 p., maps. TOP SECRET. SANITIZED copy. Released Aug. 9, 1976.",0.166375
ddrs,1982-01-01,1989070101919,Soviet Ministry of Defense monographs on World War II military operations: South Sakhalin 8/11-8/23/45-Kurile Island Operation (Invasion of Shumshu Island).,0.164513
ddrs,1974-10-22,2009110103252,,0.162501
ddrs,1950-10-26,1975040100101,"Cutback of UN Ground Forces in Korea (Other than U.S. and ROK) [JCS outline for reduction of UN countries\' commitments to Korea to ease logistics burden on the US; G-3 recommends getting concurrence from Secy of State and countries involved]. Summary Sheet, Maj. Gen. Charles L. Bolte, Asst. Chief of Staff, G-3, to Chief of Staff. Oct. 26, 1950. 1 p. Encl: Same subject. Memorandum, Gen. J. Lawton Collins, Chief of Staff, US Army, to Secy of Defense with 1 encl: Letter, Secy of Defense, to Secy of State. No date given. 2 p. Att: 1. Status of UN Aid to Korea [tabular list of current and projected offers from UN countries]. 3 p.; 2. Logistical Considerations with Respect to Reduction or Diversion of UN Forces for Korea. 2 p. TOP SECRET.",0.160913
ddrs,1964-01-20,2008110103143,,0.15814
ddrs,,2004010100127,"Talking points in preparation for U.S.-Israeli negotiations for the Israeli purchase of U.S. M-48A2C tanks, 75 combat planes, and 60 self-propelled 155mm guns.",0.157882
ddrs,1955-09-30,2004010100132,"Memorandum to Secretary of Defense Charles Wilson from the Joint Chiefs of Staff (JCS) chairman Arthur Radford regarding a list of weapons, including nuclear, and related essential equipment which might be programmed for NATO forces for fiscal year 1957.",0.157766
ddrs,1948-11-09,1975040100184,"[Statistics of Nationalist Chinese Armed Forces losses.] Am Emb Nanking, Telegram No. 2142. Transmitted to President Truman aboard USS Williamsburg. Nov. 9, 1948. 2 p. CONFIDENTIAL. Truman Library, Clark M. Clifford Papers.",0.157068
ddrs,1979-07-30,2002090102982,Letter to President Jimmy Carter from Thai Prime Minister Kriangsak Chomanan expressing appreciation for Carter\'s interest in and understanding of the many problems facing Thailand as it struggles to maintain its national security against internal and external Communist aggression.,0.155304
ddrs,1968-03-09,2009010100324,,0.15528
ddrs,1961-04-29,1996070101897,Memorandum from Captain F.T. Moore to the JCS forwarding Situation Report 115-61 on Laos.,0.154189
ddrs,1957-07-02,1980070100174,"North Atlantic [Treaty Organization] Military Committee, Special Report to the 1823/333, p. 2222-2224, incl. Transmittal Notes, Joint Secretariat. July 2-18, 1957. 2 p. Att: Same title [because 280mm and 8-inch atomic shells are already available, a completely new capability with the 155mm howitzer should be developed. A large number of 155mm howitzers in Army active and reserve units and in allied armies with an atomic capability would have a far-reaching impact on enemy plans]. Memorandum, CSAM 78-57, Chief of Staff, Army, to the JCS. June 13, 1957. 2 p.; Encl: Same title [the Secy of Defense is asked to request that the AEC proceed \""expeditiously\"" with the development of a 155mm artillery shell]. Draft Memorandum, to the Secy of Defense. 1 p. SECRET to CONFIDENTIAL. Declassified Apr. 11, 1978. Released 1979.",0.154008
ddrs,1965-06-15,2007050101397,,0.153584
ddrs,1957-10-29,1994050101319,"Resume of the development of the West German tank problem, including Germany\'s request to purchase U.S. tanks.",0.152093
ddrs,1950-07-17,1976100100120,"World Situation and Ability of the Forces Being Maintained to held with Headquarters, US Army, Pacific, Far Eastern Command, and Eighth Army in Korea. The Eighth Army HQ\'s concern over losses, ineffectiveness of US minefields, and North Korean success with armored cavalry and night warfare operations). Memorandum, Lt. Col. D.D. Dickson, Far East and Pacific Bureau, to Gen. Bolte. July 17, 1950. 3 p. Tab A: Summation of the Remarks of General MacArthur (assessment of the North Korean Army, US and South Korean military deficiencies, possibilities for stabilization of situation, defense arrangements for Formosa, and situation in Japan. Recommendation that reinforcements be sent whether or not US strength is weakened elsewhere; \""we win here or lose everywhere\""). Summary. July 13, 1950. 3 p; Tab B: Questions and Answers, First Conference (general discussion of support problems and requirements; use of atomic bomb to seal the Manchuria-North Korea border; troop requirements). Notes, unattributed. July 13, 1950. 3 p.; Tab C: Questions and Answers, Final Conference with FECOM Staff (discussion of troop movements, ammunition needs, ship deployment for the proposed Inchon landing). Notes of Conference (Gen. J. Lawton Collins, Chief of Staff, US Army; Rear Adm. Doyle, Amphibious Commander, NAVFE; Maj. Gen. Almond, Chief of Staff, FECOM; other US military officers). July 14, 1950. 2 p.; Tab D: National Police Reserve (recommendation to establish a Japanese police reserve of 75,000, armed with US weapons). Memorandum, for the Chief of Staff. July 12, 1950. 2 p.; Att. to Tab D: Serviceable Japanese Arms and Ammo on Hand. Memorandum, unattributed. July 8, 1950. 2 p.; Tab E. Outline of Major Points-Far East Visit 15 July 1950. 5 p. TOP SECRET. Declassified date not given.",0.151845
ddrs,,2000110103241,Two lists regarding U.S. weapons sales to various countries. List (1) includes the values and descriptions of U.S. sales to supplement weapons systems presently existing in: Taiwan; Iran; Israel; South Korea; Pakistan; Spain; Thailand. List (2) includes the values and descriptions of U.S. sales of new weapons systems to: Taiwan; Spain; Iran; South Korea.,0.151815
ddrs,1948-08-05,1975010100036,"[Palestine] Probable Effects on Israel and the Arab States of a UN Arms Embargo [a strong application of an embargo will lead to a military stalemate resulting in a compromise; implications to Israel and Arab States if embargo is one-sided; implications of UN failure to take positive action; present military situation; statistical data of arms supply by Arab countries; aircraft, air defense, and naval strength and supply-Israel and Arab countries]. Office of Reports and Estimates, ORE 48-48. Aug. 5, 1948. 25 p. SECRET. Declassified Jan. 21, 1975.",0.151754
ddrs,,1993110103232,Details of funding for Korean and Thai troops by U.S. to be deployed to South Vietnam; funding for additional South Vietnamese forces.,0.151413
ddrs,1964-03-19,2004050101708,Memorandum from McGeorge Bundy recommending a review of the effects of a U.S. decision to meet Israel\'s request for tanks upon U.S.-Arab relations. Recipients of this message include: Secretary of State Dean Rusk; Secretary of Defense Robert McNamara; Central Intelligence Agency (CIA) director John McCone.,0.150773
ddrs,1967-10-24,1999090102691,Text of cable from Ambassador Eugene Lock regarding a promise by the U.S. to supplyequipment to five Filipino engineering battalions that may be sent to support U.S. construction efforts in South Vietnam.,0.150686
ddrs,1964-07-17,1977070100021,"(China, People\'s Republic of) Chinese Air Defense Capabilities in Southeast Asia (North Vietnam has developed a limited air defense capability; contingency plans have probably been made for use of Chinese aircraft over North Vietnam; Pathet Lao have acquired antiaircraft guns and radar equipment from North Vietnam). Office of Current Intelligence Special Report, SC No. 00628/64B. July 17, 1964. 10 p., il. Security classification not given. SANITIZED copy. Released June 21, 1977. Johnson Library, NSF, Countries, Vietnam, Southeast Asia, SI Material.",0.15
ddrs,1978-10-02,2000090103000,Letter to President Jimmy Carter from British Prime Minister James Callaghan regarding efforts to put new U.S.-British tank and anti-tank missile systems in place to counter the Soviet version of these weapons.,0.149941
ddrs,,1994070101906,Inventory of Middle East armor.,0.149426
ddrs,1977-05-16,1997090102456,Plan for the withdrawal from Korea of the first two brigades of the 2nd Infantry Division and a proposal for military assistance to South Korea.,0.149291
ddrs,1951-03-22,1985040100839,"Analysis of Soviet military forces ability to achieve tactical cooperation in combat operations characterized by the involvement of large artillery, tanks, aviation and motorized infantry forces acting in cooperation with infantry and horse cavalry.",0.149273
ddrs,,2001090102449,Breakdown of the first and second increments of U.S. armed force units withdrawing from South Korea.,0.148718
ddrs,1961-04-25,1979040100355,"Israel\'s Manufacture and Export of Arms and Munitions [Israel is the largest and most efficient arms and ammunition producer in the Near East; the range of products has been expanded to include heavier weapons and ammunition; the munitions industry manufactures arms of foreign design for export, adapts foreign designs for the Israel Defense Force, and sometimes produces weapon innovations of Israeli design. Manufacturing rights obtained abroad, munition plants, importance of exports, and training of foreign military are subjects of discussion]. Bureau of Intelligence and Research, Report No. 8456. Apr. 25, 1961. 10 p. App: (A) Arms Plants [in Haifa, Tel Aviv, and Jerusalem areas]. 4 p.; (B) Arms and Ammunition Production and Capacity. 4 p.; (C) Key Personnel Connected with Munitions. 3 p. SECRET. NO FORN. Declassified Feb. 26, 1979.",0.147775
ddrs,,2011050101332,Report on NATO\'s Allied Command Europe\'s (ACE) conventional force programming. Issues include: magnitude of force improvement within ACE from 1962-1966; programmed improvements in country conventional forces at reduced standards.,0.14762
ddrs,1966-11-24,2004090102572,"U.S. Ambassador Findley Burns, Jr. estimates the minimum U.S. military assistance required by Jordan to satisfy that country\'s immediate military needs.",0.147542
ddrs,,2001070102087,Paper regarding Malaysian training assistance programs and the sale of military equipment to South Vietnam from 1963-1967.,0.146083
ddrs,1955-10-05,1986090102569,"Strategic requirements of allied forces for new weapons and information thereon, including atomic weapons.",0.145439
ddrs,1967-09-18,1992110103153,"DOD planning and control memo for the President on U.S. Army and Marine Corps land forces, establishing land forces structure, manpower, and material objectives for Fiscal Year 1969-1976.",0.145389
ddrs,1965-10-16,1995030100835,Jack Vaughn discusses assignment of artillery battalion to the Dominican Republic.,0.145251
ddrs,1990-05-28,2008110103294,Summary of a meeting between President George H.W. Bush and Soviet General Secretary/President Mikhail Gorbachev regarding the status of the Strategic Arms Reductions Talks II (START II). Both express satisfaction over the mutually acceptable solutions agreed to on major issues. This treaty will be a major landmark in both arms control and in the relationship between the U.S. and the U.S.S.R.,0.144762
ddrs,1959-01-04,1980010100122,"[Cuba. Four thousand rebel troops are in the Havana area. Small arms predominate, but artillery, tanks, armored cars, and antiaircraft guns have been sighted. Exiles are returning in large numbers. Castro and Urrutia have not arrived. Castro is reported slowly approaching Havana by car, slowed by cheering crowds.] USARMA Havana, Message No. 1609, to DEPTAR Washington, for ACSI, CNO, and COFSAF. Jan. 4, 1959. 2 p. CONFIDENTIAL. Declassified June 8, 1979.",0.144509
ddrs,1983-02-01,1989050101363,World machine tool industry in transition: growing role of Japanese producers detailed.,0.144007
ddrs,1958-12-11,1992030100656,Text of agreement between U.S. and Taiwan pertaining to reduction of forces on the offshore islands.,0.143679
ddrs,1967-06-29,2008070101883,"Intelligence daily summary of Soviet arms shipments to the Middle East. Highlights include the following tables: (a) possible Soviet arms carriers heading to the Middle East; (b) major Soviet equipment deliveries to the Middle East. This Soviet arms buildup to re-supply Arab countries is a result of the 6/5-6/10/1967 war between Israel and the combined forces of Egypt, Syria, Jordan, Iraq, Saudi Arabia, and Kuwait.",0.143677
ddrs,1965-06-03,2004010100254,Summary of a meeting between Israeli diplomat Mordechai Gazit and Deputy Assistant Secretary of State John Jernegan regarding an Israeli arms procurement request.,0.14359
ddrs,1952-01-08,1976010100845,"(United Kingdom) Truman-Churchill Talks (minutes of the first formal discussion covered rifle standardization, the creation of an Atlantic Command, and US-UK relations). Minutes, TCT Min - 2 (Harry S. Truman, Pres.; Dean Acheson, Secy of State; Robert A. Lovett, Secy of Defense; Winston Churchill, PM, UK; Anthony Eden, Dep. PM and Secy of State for Foreign Affairs, UK; UK and US officials). Jan. 8, 1952. 8 p. Security classification not given. SANITIZED copy. Released date not given. Truman Library, Papers of HST, PSF, General File.",0.141765
ddrs,1964-12-16,1994090102429,"Report on anniversary of Castro\'s revolution celebration on 1/1/65, topics include: parade; dispositions of units after parade; attendance of Soviets or Chinese officials; military equipment; foreign troops.",0.141436
ddrs,1983-01-20,2009070101911,,0.140625
ddrs,1961-05-17,1975070100056,"[Indonesia] Military Assistance Deliveries to Indonesia [Indonesia is presently in lowest priority category]. Memorandum, William P. Bundy, Acting Asst. Secy of Defense, to Ralph A. Dungan, Spec. Asst. to the President. May 17, 1961. 1 p. Att: (1) Tab A: Military Assistance to Indonesia [history, 1949-61; most aid has gone to Army, as it serves as counterweight to Communist influence]. 2p.; (2) Tab B: [Chart showing past military deliveries to Indonesia.] 1 p.; (3) Tab C: Estimated Deliveries/Expenditures from FY 1950-51 Program. 1 p. SECRET. Declassified Oct. 2, 1973. Kennedy Library, NSF, Indonesia, Vol. I, May-July 1961.",0.139918
ddrs,1956-08-28,1983010100203,"Briefing on maintenance, rebuilding and replacement of Army vehicular equipment in the hands of Allied Forces.",0.138997
ddrs,1952-05-10,1987090102479,"ROK, according to the U.S. Embassy, still insists that further Japanese-South Korean negotiations are futile as long as the Japanese persist in their claims in Korea.",0.138554
ddrs,1964-05-24,1992030100782,Report on possibility of Pathet Lao/North Vietnam attack on Vietiane Laos on 5/27/64.,0.138097
ddrs,1965-06-30,2004010100124,Memorandum from Jonathan Stoddart regarding the U.S.-Israeli tank negotiations with respect to the logistic and technical problems involved.,0.13728
ddrs,1974-05-01,1994090102453,"Comparison report (5/1/74) of armor, artillery and infiltration arrivals of RVNAF.",0.136364
