collection,date,id,title,topic_score
ddrs,1953-12-21,1980040100305,"[Nuclear weapons] Description of Atomic Devices and Component Parts [basic principles governing the design of gun-barrel-type and implosion-type weapons]. Information for Release to Representatives of Duly Constituted Law Enforcement Agencies. Dec. 21, 1953. 3 p. Security classification not given. Released Jan. 4, 1980. Eisenhower Library, White House Central File, Confidential File, Box 9, Atomic Weapons.",0.136105
ddrs,1967-06-30,2008110103082,"Intelligence daily summary as of 6:00 p.m. on 6/29/1967 of Soviet arms shipments to the Middle East listing sea shipments of military equipment to Egypt, Algeria, and Iraq. Also included are the following tables: possible Soviet arms carriers to the Middle East; major Soviet equipment inventory in Egypt.",0.134454
ddrs,1979-08-15,2002110103215,"Text of Thai Prime Minister Kriangsak Chomanan\'s message to President Jimmy Carter regarding that country\'s struggle to maintain its national security against internal and external Communist aggression. Chomanan is concerned over possible Vietnamese military actions against Thailand. In addition, he requests the U.S. provide immediate delivery of the following foreign military sales items: tanks; dragon anti-tank missile systems; howitzers; helicopters.",0.134413
ddrs,1963-11-06,2004090102429,"Special National Intelligence Estimate no. 36.7-63 entitled: \""The Situation and Prospects in Yemen.\"" Topics include: the Republican government; Royalist forces; the present situation; attitudes of outside powers; the political outlook; Soviet intervention.",0.133788
ddrs,1949-08-18,1975040100312,"Police and SED [Sozialistische Einheits Partei Deutschlands] Personalities for Germany (Heidelberg), Despatch No. 448. Aug. 18, 1949. 1 p. Encl: Same subject [procurement of heavy weapons and tanks for the Alert Police]. Inteiligence Division, European Command, US Army, RP-275-49. Aug. 16, 1949. 3 p SECRET. Declassified Aug. 21, 1974.",0.133334
ddrs,,2009070101940,Discussion paper on certain aspects of the U.S. political and military relationship with Canada.,0.133106
ddrs,,2007010100086,Draft information on the cost of U.S. tank sales to Israel.,0.132957
ddrs,1977-05-16,2001070101856,"Deputy Secretary of Defense Charles Duncan, Jr. provides President Jimmy Carter with a detailed plan for the withdrawal from South Korea of the first two brigades of the U.S. 2nd Infantry Division. Duncan also proposes a military assistance program for South Korea.",0.13204
ddrs,1956-12-12,1984010100113,Comments and observations by Major General Bowen concerning topics Chinese National Defense Minister Yu Ta-wei plans to discuss during U.S. visit.,0.132
ddrs,1964-07-07,2005050101458,Memorandum to President Lyndon B. Johnson from Acting Secretary of State George Ball recommending that Johnson approve the sale of M-48 tanks to Israel through secret West German and Italian intermediaries.,0.131579
ddrs,,1995010100422,Progress report on U.S. Marine Operation Star Lite launched against the VC.,0.131412
ddrs,1968-03-11,1995010100045,"Sec. Clifford\'s 3/11/68 memo to the President, topics include: Gen. Westmoreland\'s request for additional forces; USM figures; four battalions in the pipeline; aircraft squadrons; reserve forces; Program 5.; Korea, Thai and SVN forces.",0.13124
ddrs,1967-07-01,2008110103083,"Intelligence daily summary as of 6:00 p.m. on 6/30/1967 of Soviet arms shipments to the Middle East listing sea shipments of military equipment to Egypt, Algeria, Syria, and Iraq. Also included are the following tables: possible Soviet arms carriers to the Middle East; major Soviet equipment inventory in Egypt.",0.131099
ddrs,1983-05-01,1989050101364,Problems and prospects for Soviet numerically controlled machine tools.,0.130662
ddrs,1964-04-21,2006010100213,"President Lyndon B. Johnson is provided with an outline of appropriate responses to Israel\'s appeal for military assistance, including a request to purchase 300 to 500 medium-size tanks.",0.130542
ddrs,1971-02-23,2005110103302,"Interstate Commerce Commission (ICC) Service Order no. 1063 entitled: \""Railroad Operating Regulations for Freight Car Movement.\"" This document assures that enough boxcars will be available for the movement of agricultural, mineral, forest, manufactured pr",0.129661
ddrs,1983-01-20,2008010100100,Text of Associate Attorney General Rudolph Giuliani\'s reply to Representative Mario Biaggi\'s (D-New York) 11/22/82 letter regarding possible legislation for the prevention of easy criminal access to armor-piercing handgun bullets.,0.129033
ddrs,1980-02-25,1988070101830,Vietnamese chemical warfare in Kampuchea discussed.,0.128876
ddrs,,1985040100886,Estimated performance of the Type 37 Heavy Bomber and the Type 39 Medium Bomber.,0.127788
ddrs,,2002070102074,Description of the types of materials needed for the construction of an atomic bomb.,0.12774
ddrs,,1992050101272,U.S. Navy Dept. notes on Soviet fleet.,0.127619
ddrs,1963-12-27,2000050101280,"National Intelligence Estimate no. 11-10-63 entitled: \""Soviet Capabilities and Intentions with Respect to Chemical Warfare.\""",0.127578
