collection,date,id,title,topic_score
kissinger,1974-06-05 10:43:00,0000C1CC,Telecon with Dobrynin and Kissinger at 10:43 A.M.,0.123077
kissinger,1974-06-06 12:45:00,0000C99D,TELECON WITH MR. SONNELFT/SECRETARY KISSINGER AT 12:45 P.M.,0.0930232
kissinger,1975-09-13 12:50:00,0000BE23,TELECON WITH MR. LORD/THE SECRETARY AT 12:50 P.M.,0.0921048
kissinger,1975-09-08 19:38:00,0000BDE3,TELECON WITH MR. WINSTON LORD/THE SECRETARY AT 7:38 P.M.,0.0808828
kissinger,1975-09-20 11:25:00,0000DA5E,TELECON WITH WIN LORD AT 11:25 A.M.,0.07978
kissinger,1975-03-31 10:02:00,0000D850,TELECON WITH AMBASSADOR DOBRYNIN AT 10:02 A.M.,0.07874
kissinger,1976-07-29 09:30:00,0000BE9E,Telecon with Kissinger and Butz AT 9:30 A.M.,0.0746268
kissinger,1975-04-10 15:28:00,0000BBF3,TELECON WITH HUMPHREY AT 3:28 P.M.,0.0743246
kissinger,1974-03-06 12:50:00,0000C46A,Telecon with Scali and Kissinger at 12:50 P.M.,0.0740738
kissinger,1974-01-30 22:33:00,0000C67F,Telecon with Kissinger and Dinitz at 10:33 P.M.,0.0721318
kissinger,1974-03-21 09:12:00,0000C4D8,Telecon with Kissinger and Helmut Sonnenfeldt at 9:12 A.M.,0.0705131
kissinger,1974-11-16 17:50:00,0000D79D,TELECON WITH MR. SONNENFELDT AT 5:50 P.M.,0.068182
kissinger,1974-01-31 19:50:00,0000C688,Telecon with Kissinger and Dinitz at 7:50 P.M.,0.0662983
kissinger,1974-09-19 19:10:00,0000D66E,TELECON WITH JOE KRAFT AT 7:10 P.M.,0.0649356
kissinger,1974-04-12 09:14:00,0000C505,Telecon with the President and Kissinger at 9:14 A.M.,0.0631073
kissinger,1975-09-30 11:30:00,0000BEC3,TELECON WITH PETE PETERSON/HAK AT 11:30 A.M.,0.0629386
kissinger,1975-02-02 00:00:00,0000CF50,TELECON WITH MR. MCNAMARA/SECRETARY KISSINGER AT 10:00 AM,0.0624986
kissinger,1973-12-03 17:07:00,0000C5B6,Telecon with Dobrynin and Kissinger at 5:07 P.M.,0.0585108
kissinger,1975-06-05 15:10:00,0000C005,Telecon with Kissinger and Jack Anderson AT 3:10 P.M.,0.0568568
kissinger,1975-07-08 10:58:00,0000D817,TELECON WITH JOE KRAFT AT 10:58 A.M.,0.0495495
kissinger,1974-03-22 00:00:00,0000C4EF,Telecon with John Mulliken and Kissinger 4:45 P.M.,0.0494718
kissinger,1973-10-07 15:25:00,0000C246,TELECON WITH AMBASSADOR DOBRYNIN - SECRETARY KISSINGER AT 3:,0.0483878
kissinger,1973-10-03 00:00:00,0000CF7F,TELECON WITH DAVID ABSHIRE/HAK AT 9:28,0.0478299
kissinger,1974-08-10 13:50:00,0000D692,TELECON WITH SENATOR JAVITS AT 1:50 P.M.,0.0476189
kissinger,1974-01-28 11:23:00,0000C669,Telecon with Kissinger and the President at 11:23 A.M.,0.0471705
kissinger,1974-02-17 17:05:00,0000C95A,TELECON WITH DINITZ AT 5:05 P.M.,0.0471203
kissinger,1974-03-29 20:00:00,0000C591,TELECON WITH JERRY SCHECTER AT 8:00 P.M.,0.0448278
kissinger,1976-01-16 15:50:00,0000C1ED,Telecon with Kissinger and Dobrynin AT 3:50 P.M.,0.0437501
kissinger,1974-01-23 21:45:00,0000C65C,Telecon with Kissinger and Jackson at 9:45 P.M.,0.0422536
kissinger,1976-08-03 00:00:00,0000D90C,TELECON WITH KISSINGER/ATTORNEY GENERAL LEVI AT 3:05PM,0.0413787
kissinger,1974-04-27 00:00:00,0000C56B,Telecon with Cranston and Kissinger at 3:20,0.0406571
kissinger,1976-11-17 11:10:00,0000DA36,TELECON WITH HAROLD LEVER AT 11:10 A.M.,0.0406505
kissinger,1975-02-02 10:05:00,0000D7D9,TELECON WITH MR. SCOTTY RESTON AT 10:05 A.M.,0.0405407
kissinger,1974-07-19 22:06:00,0000CA86,TELECON WITH PRESIDENT/KISSINGER AT 10:06 P.M.,0.04023
kissinger,1976-10-13 19:45:00,0000D96E,TELECON WITH MAX FISHER AT 7:45 P.M.,0.039732
kissinger,1973-10-31 18:02:00,0000C8FD,TELECON WITH DOBRYNIN/KISSINGER AT 6:02 P.M.,0.0397117
kissinger,1975-01-14 17:45:00,0000BB27,TELECON WITH MATHIAS AT 5:45 P.M.,0.0387597
kissinger,1974-08-06 18:10:00,0000CA72,TELECON WITH AMBASSADOR MCCLOSKEY/THE SECRETARY AT 6:10 P.M.,0.0387596
kissinger,1974-07-20 13:45:00,0000CA1B,TELECON WITH MCCLOSKEY/HAK/BUFFUM AT 1:45 P.M.,0.0387577
kissinger,1976-01-09 12:55:00,0000BD4C,Telecon with Kissinger and Alan Cranston AT 12:55 P.M.,0.0378788
kissinger,1973-10-03 11:20:00,0000CF80,TELECON WITH SECRETARY KISSINGER/DIRECTOR COLBY AT 11:20 A.M,0.0362319
kissinger,1973-11-28 19:35:00,0000C6D3,TELECON WITH WALDHEIM AT 7:35 P.M.,0.0344828
kissinger,1976-12-20 18:25:00,0000C146,TELECON WITH AMB. DOBRYNIN/THE SECRETARY AT 6:25 P.M.,0.033898
kissinger,1976-04-06 17:00:00,0000BFA7,TELECON WITH AMBASSADOR DINITZ/SECRETARY KISSINGER AT 5:00 P,0.0338889
kissinger,1973-10-06 18:25:00,0000C22B,TELECON WITH FONMIN EBAN - SECRETARY KISSINGER AT 6:25 P.M.,0.0333335
kissinger,1974-03-12 18:07:00,0000C495,Telecon with Dean Brown and Kissinger at 6:07 P.M.,0.0333333
kissinger,1973-10-27 12:20:00,0000C8BA,TELECON WITH DOBRYNIN/KISSINGER AT 12:20 P.M.,0.0330581
kissinger,1975-12-24 15:45:00,0000BE1F,Telecon with Kissinger and Rogers AT 3:45 P.M.,0.0327869
kissinger,1975-06-19 10:55:00,0000D82B,TELECON WITH TAFT SCHREIBER AT 10:55 A.M.,0.0324326
kissinger,1975-11-05 18:47:00,0000D8C5,TELECON WITH PRESIDENT NIZON AT 6:47 P.M.,0.0322582
kissinger,1973-09-27 10:29:00,0000C191,TELECON WITH DAVE ABSHIRE/SECY KISSINGER AT 10:29 A.M.,0.0322581
kissinger,1974-06-06 18:40:00,0000C9A4,TELECON WITH ROBERT MCCLOSKEY/SECRETARY KISSINGER AT 6:40 P.,0.0320001
kissinger,1973-10-03 12:46:00,0000C1FE,TELECON WITH SENATOR HUGH SCOTT - SECRETARY KISSINGER AT 12:,0.0314963
kissinger,1973-10-27 15:30:00,0000C8C2,TELECON WITH HAIG/KISSINGER AT 3:30 P.M.,0.0314962
kissinger,1976-01-28 15:30:00,0000D710,TELECON WITH CHAIRMAN SPARKMAN AT 3:30 P.M.,0.0312501
kissinger,1974-01-09 14:40:00,0000C632,Telecon with Pell and Kissinger at 2:40 P.M.,0.0303031
kissinger,1974-11-15 16:38:00,0000D9A7,TELECON WITH AMBASSADOR DOBRYNIN AT 4:38 P.M.,0.0296299
kissinger,1973-09-30 14:40:00,0000C1C2,TELECON WITH MARK PALMER/SECRETARY KISSINGER AT 2:40 P.M.,0.0254238
kissinger,1974-08-05 13:05:00,0000CA6A,TELECON WITH SECRETARY SCHLESINGER/SECRETARY KISSINGER AT 1:,0.0252101
kissinger,1975-01-28 13:00:00,0000BB50,TELECON WITH PASTORE AT 1:00 P.M.,0.0236222
kissinger,1974-06-22 13:24:00,0000C9CE,TELECON WITH SENATOR JAVITS/SECRETARY KISSINGER AT 1:24 P.M.,0.0236221
kissinger,1973-10-06 00:00:00,0000C230,TELECON WITH GENERAL HAIG/SECRETARY KISSINGER AT 8:00,0.0234375
