collection,date,id,title,topic_score
kissinger,1973-11-02 00:00:00,0000C90B,TELECON WITH MR. FLANIGAN - SECRETARY KISSINGER AT 2:35,0.0784244
kissinger,1973-10-16 11:42:00,0000C7D6,TELECON WITH DOBRYNIN/SEC KISSINGER AT 11:42 A.M.,0.0725804
kissinger,1975-06-05 09:45:00,0000DA25,TELECON WITH MR. ARTHUR BURNS AT 9:45 A.M.,0.0610687
kissinger,1975-07-18 19:08:00,0000D95C,TELECON WITH MR. EAGLEBURGER AT 7:08 P.M.,0.0601505
kissinger,1973-11-26 10:34:00,0000C5A2,Telecon with Carl Maw and HAK at 10:34 A.M.,0.05988
kissinger,1974-07-23 15:30:00,0000CA30,TELECON WITH PRIME MINISTER ECEVIT/SECRETARY KISSINGER AT 3:,0.0564105
kissinger,1976-08-30 18:45:00,0000BF45,Telecon with the Secretary and Barry Schweid AT 6:45 P.M.,0.0529791
kissinger,1976-08-24 10:45:00,0000DA34,TELECON WITH SEN. HUMPHREY AT 10:45 A.M.,0.0528469
kissinger,1973-10-26 09:32:00,0000C1A2,Telecon with Dobrynin and HAK at 9:32 A.M.,0.0526318
kissinger,1974-03-14 14:45:00,0000C4A4,Telecon with Dinitz and Kissinger at 2:45 P.M.,0.0510645
kissinger,1975-06-16 15:20:00,0000C052,Telecon with Charles Robinson and Kissinger AT 3:20 P.M.,0.0500002
kissinger,1974-09-20 08:05:00,0000D6AA,TELECON WITH MR. COLBY AT 8:05 A.M.,0.0468751
kissinger,1973-10-06 19:10:00,0000C22F,TELECON WITH GENL HAIG/SEC KISSINGER AT 7:10 P.M.,0.0451602
kissinger,1974-07-26 12:55:00,0000CA37,TELECON WITH JOHN NEWHOUSE/KISSINGER AT 12:55 P.M.,0.0425533
kissinger,1975-04-23 19:37:00,0000D878,TELECON WITH MR. LES GELB AT 7:37 P.M.,0.0412843
kissinger,1975-01-23 10:25:00,0000BB78,TELECON WITH SCOTTY RESTON AT 10:25 A.M.,0.0411768
kissinger,1974-04-24 18:13:00,0000C554,Telecon with William Simon and Kissinger at 6:13 P.M.,0.0406504
kissinger,1973-10-26 16:05:00,0000C89A,TELECON WITH THE PRESIDENT/SEC KISSINGER AT 4:05 P.M.,0.0406503
kissinger,1973-10-16 14:35:00,0000C7DC,TELECON WITH GOV ROCKEFELLER/SEC KISSINGER AT 2:35 P.M.,0.0403196
kissinger,1975-09-20 00:00:00,0000BE59,TELECON WITH UNDER SECRETARY SISCO/SEC. KISSINGER AT 2:37,0.0384615
kissinger,1976-03-17 18:00:00,0000D731,TELECON WITH SENATOR HUBERT HUMPHREY AT 6:00 P.M.,0.0384612
kissinger,1973-09-27 18:40:00,0000C198,TELECON WITH MR. KISSINGER/AMB. MOYNIHAN AT 6:40 P.M.,0.0381678
kissinger,1976-11-18 10:05:00,0000D999,TELECON WITH GOV. HARRISMAN AT 10:05 A.M.,0.0375941
kissinger,1975-10-13 16:25:00,0000D96F,TELECON WITH SENATOR LAXALT AT 4:25 P.M.,0.0372672
kissinger,1976-07-09 00:00:00,0000D8FC,TELECON WITH KISSINGER/BILL HYLAND AT 12:45PM,0.0370372
kissinger,1974-02-08 10:32:00,0000C6AC,Telecon with Kissinger and David Rockefeller at 10:32 A.M.,0.036901
kissinger,1975-06-25 13:05:00,0000C070,Telecon with Sisco and Kissinger AT 1:05 P.M.,0.0364963
kissinger,1974-01-06 12:45:00,0000C614,Telecon with Dean Rusk and Kissinger at 12:45 P.M.,0.0361448
kissinger,1974-08-03 00:00:00,0000CA63,TELECON WITH MR HARTMAN AT 9:35AM,0.0357146
kissinger,1975-09-11 00:00:00,0000CF61,TELECON WITH SENATOR RIBBICOFF/SECRETARY KISSINGER AT 3:38 P,0.0340136
kissinger,1975-04-09 14:50:00,0000D85A,TELECON WITH JOE SISCO AT 2:50 P.M.,0.0336545
kissinger,1973-10-17 17:20:00,0000C7F5,TELECON WITH DINITZ/KISSINGER AT 5:20 P.M.,0.0335571
kissinger,1975-02-20 14:50:00,0000D839,TELECON WITH ABMASSADOR DINITZ AT 2:50 P.M.,0.033557
kissinger,1975-01-31 19:35:00,0000D7D6,TELECON WITH AMB. DINITZ AT 7:35 P.M.,0.0333339
kissinger,1976-04-15 15:00:00,0000DA51,TELECON WITH MR. EDWIN YEO AT 3:00 P.M.,0.0330583
kissinger,1976-07-10 00:00:00,0000D8FB,TELECON WITH KISSINGER/HENRY CABOT LODGE AT 12:05PM,0.0327875
kissinger,1976-07-20 00:00:00,0000D933,TELECON WITH KISSINGER/LES GELB AT 4:40PM,0.0323887
kissinger,1975-11-03 08:20:00,0000D8BB,TELECON WITH SCOTTY RESTON AT 8:20 A.M.,0.0316746
kissinger,1973-10-06 21:07:00,0000C237,TELECON WITH MR. SISCO/SECRETARY KISSINGER AT 9:07 P.M.,0.0312497
kissinger,1975-01-04 16:10:00,0000D9C2,TELECON WITH AMBASSADOR RAMSBOTHAM AT 4:10 P.M.,0.0305344
kissinger,1974-06-08 11:05:00,0000C9B9,TELECON WITH HAL SONNENFELDT/SECRETARY KISSINGER AT 11:05 A.,0.0296299
kissinger,1975-06-06 17:51:00,0000CF5A,TELECON WITH MR. ENDERS/THE SECRETARY AT 5:51 P.M.,0.0296297
kissinger,1976-03-10 15:20:00,0000D723,TELECON WITH DICK VALERIANI AT 3:20 P.M.,0.0294123
kissinger,1975-04-01 10:35:00,0000BBE0,TELECON WITH SISCO AT 10:35 A.M.,0.0287772
kissinger,1973-11-26 09:54:00,0000C5A1,Telecon with Buchanan and HAK at 9:54 A.M.,0.0287771
kissinger,1976-07-26 13:06:00,0000D9D2,TELECON WITH THE PRESIDENT AT 1:06 P.M.,0.0277779
kissinger,1975-01-03 19:54:00,0000D7D2,TELECON WITH KENNETH FREED AT 7:54 P.M.,0.0256411
kissinger,1974-07-25 00:00:00,0000C1D8,Telecon with Vorontsov and Kissinger,0.0252103
kissinger,1975-11-05 18:47:00,0000D8C5,TELECON WITH PRESIDENT NIZON AT 6:47 P.M.,0.0241936
