collection,date,id,title,topic_score
ddrs,1975-09-10,1996110103523,Henry A. Kissinger\'s memorandum on WH meeting with John Reagan McCrary to discuss U.S.-Greek relations relative to U.S. military assistance to Turkey.,0.221817
ddrs,1959-01-08,1992010100469,Operations Coordinating Board (OCB) report on Greece covering period from 5/15-12/17/58 detailed.,0.220431
ddrs,1957-04-24,1987070102235,Progress report on U.S. policy toward Yugoslavia.,0.220047
ddrs,1964-08-27,2005110103162,U.S. Ambassador Taylor Belcher updates Secretary of State Dean Rusk on a decision made by Cypriot and Greek government officials to stand together against any Turkish military attack upon the island of Cyprus.,0.219442
ddrs,1968-10-25,1999110103176,Report on U.S. government decision-making during the 1964 and 1967 clashes between Greek and Turkish nationalists on the island of Cyprus.,0.218517
ddrs,1976-04-02,1996110103571,Background and talking points for U.S.-Turkish defense cooperation agreement.,0.218182
ddrs,1967-11-24,1998070102024,"Memorandum of conversation between Prime Minister Constantine Kollias, Ambassador Phillips Talbot, Cyrus Vance, and John P. Walsh regarding U.S. efforts to help end thedispute between Greece and Turkey over Cyprus.",0.217914
ddrs,1965-05-13,2000070102025,Cable regarding Greece\'s reluctance to meet with Turkish officials concerning the situation in Cyprus.,0.217558
ddrs,1965-02-16,2008110103172,,0.217353
ddrs,1955-04-13,2007110103599,,0.216992
ddrs,1975-05-15,2001090102860,Turkish Cypriot President Rauf Denktash updates President Gerald Ford on the situation between Greek and Turkish Cypriots. Denktash hopes he will represent Cyprus at a Geneva heads-of-state Summit Conference as the true leader of that island country.,0.21665
ddrs,1956-04-04,2008090102952,Operations Coordinating Board (OCB) progress report on U.S. policy toward Turkey from 9/8/1955-4/4/1956. Issues include: weakening of relations between Turkey and Greece; U.S. military aid to Turkey; deterioration of the Turkish economic situation; Turkey\'s relations with Free World countries; Turkish stabilization program.,0.216549
ddrs,1964-09-05,2005030100741,"Text of a 9/2/64 meeting between Dean Acheson, British Defense Minister Peter Thorneycroft, and other U.S. and British government officials regarding the Greek-Turkish conflict over the island of Cyprus.",0.216546
ddrs,1952-11-01,1989030101012,"Current Policies of the Government of the United States of America Relating to the National Security:Volume I, Geographical Area Policies:Part V, Middle East - Turkey.",0.215811
ddrs,1957-04-04,1992010100385,NSC progress report on U.S. policy toward Yugoslavia (NSC 5601).,0.215785
ddrs,1958-06-02,1992090102818,OCB report on Greece summarized.,0.215687
ddrs,1967-12-02,1999090102532,"Teleconference between the State Department and UN officials meeting in Nicosia, Cyprus regarding the status of negotiations to end hostilities between Greece and Turkey over the island of Cyprus.",0.215627
ddrs,1952-06-05,1992050101793,Plan to assist by psychological means the retention of Yugoslavia in the anti-Soviet camp outlined.,0.214467
ddrs,1952-11-01,1989030101032,"Current Policies of the Government of the United States of America Relating to the National Security:Volume I, Geographical Area Policies:Part VI, Europe - Yugoslavia.",0.213618
ddrs,1956-04-04,2007110103542,,0.213155
ddrs,1967-06-28,2011090102582,"Background paper on the situation in Cyprus in preparation for Secretary of State Dean Rusk\'s attendance at the London, England, 7/11-7/12/1967 fifteenth session of the Central Treaty Organization (CENTO) Ministerial Council. CENTO, also known as the Baghdad Pact, was adopted in 1955 by Iran, Iraq, Pakistan, Turkey, and Great Britain. CENTO members are committed to mutual cooperation and protection, as well as a vow of non-intervention in each other\'s affairs.",0.212511
ddrs,1964-08-08,1979070100266,"[Foreign Min. Erkin told of reports that villages around Kokkina had fallen; fall thousand Greeks have returned to Cyprus, mostly students, retired officers, and a limited number trying to desert the Greek army to join the Cypriot army. The Cypriot government is trying to raise its own army; it has already raised 25,000 and should be able to reach 50,000. No regular Greek forces are in Cyprus other than the 950-man unit permitted by treaty. No equipment of the Greek armed forces has been sent to the island. Gen. Sunay of Turkey told Lemnitzer that no military units or individuals of the Turkish armed forces are in Cyprus apart from the 650-man unit permitted by treaty. Those Turkish elements fighting are doing so in self-defense and to protect the rights of the Turkish community.] Am Emb Paris, Telegram No. POLTO 225, to the Secy of State, and No. POLTO 39, to US Mission to Geneva, for Acheson. 2 Sections. Aug. 8, 1964. 4 p. SECRET. Declassified May 24, 1979. Johnson Library, NSF, NSC History, Cyprus Crisis, Dec. 1963-1967.",0.212015
