collection,date,id,title,topic_score
ddrs,1992-07-30,2005010100197,"Summary of UN special representative Max Van Der Stoel\'s interim report on Iraq\'s human rights violations, especially in the southern part of that country.",0.0935258
ddrs,1977-03-16,2001110103549,Summary of a 3/15/77 meeting between the Council on Environmental Quality (CEQ) and major environmental and public interest group representatives on plans to ship foreign spent nuclear fuel to the U.S. for storage.,0.0934106
ddrs,1968-07-11,1991090102430,Status of Viet Cong effort to establish liberation committees at the village and hamlet level.,0.0933312
ddrs,,2000010100070,List of foreign claims and Department of State comments on U.S. navigational and training flights over various countries. These include: Peru; Ecuador; El Salvador; Panama; Barbados; Haiti; Somalia; Albania; Algeria; Libya; Indonesia; Philippines; Fiji Islands; Solomon Islands.,0.0931913
ddrs,1971-10-27,2009010100063,Memorandum to National Security Adviser Henry Kissinger from Central Intelligence Agency (CIA) director Richard Helms informing him of a new North Vietnamese overture on a prisoner exchange program.,0.0931105
ddrs,1968-12-09,2004030100637,"Intelligence cable regarding Viet Cong plans for its December 1968 phase of the Winter-Spring campaign against Tay Ninh Province, South Vietnam.",0.0916976
ddrs,1979-05-09,1999050101706,Original and translated copy of a letter to President Jimmy Carter from Chancellor Helmut Schmidt on the 30th anniversary of the end of the Berlin blockade.,0.0915492
ddrs,1968-05-24,1998090102787,Cable regarding Col. Phan Viet Dung\'s attitude toward the formation of a National Reconciliation Program for all of Vietnam.,0.0914636
ddrs,1962-04-16,1979010100237,"[Eritrea] Monthly Summary of Events--December 1961 [pro-Ethiopian Vice President allegiances of Muslim, pastoral peoples living on Red Sea coast of Eritrea including the Rascheida tribe and leaders in Waikiro, Dogali, and Arkiko]. Am Con Asmara, Despatch No. 76. Apr. 16, 1962. 5 p. CONFIDENTIAL. Declassified date not given.",0.0914213
ddrs,1963-09-21,1981100100102,"[Vietnam and Vietnam War] David Halberstam Article, \""Rift with Saigon on War Tactics Underlined by 2 Red Attacks,\"" New York Times, 16 September 1963. Robert McNamara, Secy of Defense, Transmittal Memorandum, to the Pres. Sept. 21, 1963. 1 p. Encl.: Same subject [David Halberstam\'s New York Times article claiming that the US wants to halt the strategic hamlet program while the Vietnamese insist on continuing and that the US has suggested complete revision of tactics in the delta is largely incorrect. Although mistakes have been made in implementation, the US and SVN basically agree on strategic hamlet program goals and the US has recommended no drastic policy changes. Halberstam\'s article understates the effectiveness of ARVN offensive action, overstates VC successes, and fails to mention the four-to-one casualty ratio in favor of SVN forces]. Report. 19 p., il. SECRET. Declassified Sept. 18, 1981. Kennedy Library, NSF, Countries, Vietnam, Halberstam Article, Sept. 1963, Box 204.",0.0914118
