collection,date,id,title,topic_score
ddrs,,1980070100001,"Brazil 1961-64, Policy Framework Governing A.I.D. Lending to [the US arranged a multilateral program of external assistance for Brazil in 1961 to help Pres. Quadros pursue a sound economic course. Quadros\'s resignation and Goulart\'s assumption of the presidency coincided with the formation of the Alliance for Progress, which viewed the problems in the northeast of Brazil as a crucial test for the Alliance. The US agreed to extend $119 million for a northeast assistance program in April 1962. In 1963 $398.5 million was released in support of the Three Year Economic Development Plan for Brazil. In June of 1963, the Brazilian finance minister, Santiago Dantas, resigned after his stabilization efforts failed. His successors also made no progress, and the US suspended balance of payments assistance and continued only PL 480 wheat sales. The US lending strategy became one of supporting friendly states within Brazil and strengthening the image of the Alliance for Progress and US in such a way as not to strengthen Goulart\'s national govt. The new govt. following the coup in April 1964 promptly received balance of payments support and stepped-up project loan commitments to tide the govt. over until its stabilization and reform program can be launched in the fall of 1966]. Background Paper [to unattached document]. [1965?] 5 p. SECRET. Declassified Jan. 29, 1980. Johnson Library, NSF, Countries, Brazil, Vol. 7A.",0.11456
ddrs,1964-01-11,1976100100224,"(Brazil. Informal translation of proposed text of letter from Goulart and other Brazilian economic matters.) Am Emb Rio de Janeiro, Telegram No. 1423. 2 Sections. Jan. 11, 1964. 4 p. CONFIDENTIAL. LIM DIS. EX DIS. Declassified Aug. 10, 1976. Johnson Library, NSF, Countries, Brazil, Vol. 1.",0.113896
ddrs,1984-09-19,2004030100897,Memorandum to the members of the Implementation Group (IG) from Assistant Secretary of the  Treasury David Mulford regarding Argentina\'s financial and economic developments and its relationship with the International Monetary Fund (IMF).,0.112957
ddrs,1968-02-05,1999030101133,Walt Rostow\'s memo to President Johnson regarding Johnson\'s 2/5/68 appointment with Covey Oliver to discuss policy and personnel matters relating to Latin America. Topics of meeting will include: Symington-Conte-Long amendments; U.S. representation in CIAP and the OAS; U.S. Executive Director on the Inter-American Development Bank (IDB); U.S. Ambassador to Argentina; the Border Development Commission.,0.11275
ddrs,1965-07-08,2000050101572,Cable regarding a list of candidates for the UN General Assembly presidency.,0.112556
ddrs,1962-09-19,1979070100006,"[Brazil] Position to Be Taken by Brazil at United Nations and in Meeting of Foreign Ministers; Planned Meeting of Brazilian Foreign Minister with Jamil Abd-Al-Nasir of Egypt. Information Report, TDCS-3/522, 742. Sept. 19, 1962. 3 p. Security classification not given. SANITIZED copy. Released date not given.",0.112501
ddrs,1972-09-20,2008030101145,"Text of President Richard M. Nixon\'s directive with respect to National Security Decision Memorandum (NSDM) no. 190 - Lend-Lease negotiations with the U.S.S.R. Nixon details U.S. demands to be met before the resumption of negotiations for a settlement of the Soviet Lend-Lease debt to the U.S. Lend-Lease came into existence with the passage of the Lend-Lease Act of 3/11/1941, which permitted the President of the United States to \""sell, transfer title to, exchange, lease, lend, or otherwise dispose of, to any such government any defense article.\""",0.111801
ddrs,1966-08-15,2001010100345,Memorandum from Acting Secretary of State George Ball regarding Congressional inquiries concerning WWI war debts and reparations to Germany.,0.111113
ddrs,1961-06-06,1994110103160,"George H. Willis summarizes a 5/18/61 meeting between Treasury Secretary Dillon and French Foreign Minister Baumgartner, topics include: U.S. economic situation and balance of payments; French economic and financial situation; International Monetary Fund problems.",0.111112
ddrs,1964-10-23,1977040100399,"(Cuban missile crisis: Douglas Dillon recommends prompt elimination Memorandum, Robert M. Sayre, to McGeorge Bundy, Spec. Asst. to the Pres. for Nat. Security Affairs. Oct. 23, 1964. 2 p. CONFIDENTIAL. Declassified Nov. 25, 1975. Johnson Library, NSF, Countries, Brazil, Vol. 5.",0.111111
ddrs,1986-05-12,2000090102804,Cable regarding International Monetary Fund (IMF) policy impositions on President Mobutu Sese Seko\'s Zairian government.,0.110835
ddrs,1963-05-03,1981010100017,"Brazil, Economic Deterioration and Leftist Gains in [Brazil owes $138.2 million. The Brazilians have postponed paying their debt to petroleum companies until 1963. Although an $84 million aid package was received from the US, this only temporarily alleviates the foreign exchange problem. Communists now direct three of Brazil\'s five national labor unions and will probably take over the remaining two by the year\'s end. In Pernambuco the pro-Communist governor has appointed Communists to key state positions. The military is concerned about leftism, and career officers are worried about their jobs if they oppose Goulart. Coup-plotting has not yet reached an advanced stage]. Office of Current Intelligence Special Report, OCI No. 0278/63B. May 3, 1963. 5 p. Security classification not given. SANITIZED copy. Released Mar. 31, 1976.",0.110505
ddrs,1964-11-16,1979100100274,"[Brazil. Analysis of crisis involving the military-police investigation of Governor of Goia Mauro Borges, the theft of weapons from a Reserve Officer Training Unit, and movements of federal troops to the region. Gov. Borges is being investigated primarily for permitting \""extreme leftist and Communist infiltration\"" of his govt.] Am Emb Brasilia, Telegram No. 75. 2 Sections. Nov. 16, 1964. 4 p. CONFIDENTIAL. Declassified May 2, 1977.",0.110344
ddrs,1964-10-23,2002030101078,Robert Sayre provides a background paper in preparation for a meeting on U.S. economic programs for both Chile and Brazil. Participants include: Assistant Secretary of State Thomas Mann; Deputy Assistant Administrator Anthony Solomon; Ralph Dungan; U.S. Ambassador Lincoln Gordon; William Rogers; William Dentzer; Ralph Burton; Francis Bator; Robert Sayre.,0.110294
