collection,date,id,title,topic_score
ddrs,1952-10-24,1978070100131,"[Nuclear weapons] Transmittal Memorandum, James S. Lay, Jr., Exec. Secy, to the developments and the announcement of IVY test series at Eniwetok.] Memorandum, S. Everett Gleason, Acting Exec. Secy, to the President. Oct. 24, 1952. 2 p. Att. (1): Psychological Exploitation of Certain Thermonuclear Developments. Transmittal Memorandum, James S. Lay, Exec. Secy, to the Secys of Defense and State, and the Chairman, AEC. Sept. 17, 1952. 2 p.; App. (A) to Att. (1): Same subject. Joint Defense-AEC Press Release. 1 p.; App. (B) to Att. (1): Same subject. Statement, Chairman, AEC. 1 p.; App. (C) to Att. (1): Same subject. Announcement, Chairman, AEC. 1 p.; Att. (2): Same title [revision of Appendix B]. Memorandum, S. Everett Gleason, to the Secys of State and Defense, and the Chairman, AEC. Oct. 21, 1952. 1 p. TOP SECRET. RESTRICTED DATA. ATOMIC ENERGY ACT OF 1946. Declassified Jan. 20, 1978. Truman Library, Papers of Harry [Nuclear weapons] Transmittal Memorandum, James S. Lay, Jr., Exec. Secy, to the",0.161887
ddrs,1966-05-02,2004090102976,"President Lyndon B. Johnson is provided with a daily report on the military situation in Vietnam. Issues include: update on U.S. and/or South Vietnamese operations BIRMINGHAM, OSAGE, GEORGIA, LONGFELLOW and LEXINGTON; status of reconnaissance missions over North Vietnam. Also included is the weekly casualty list of Viet Cong, South Vietnamese, U.S. and other Allied forces killed, wounded, or missing/captured, along with the cumulative figures from the first of the year and from the start of the conflict from 1/1/61.",0.161803
ddrs,1953-03-30,1986070101832,"Statement by the Acting Secretary of Defense, Roger M. Kyes, on the transfer of custody of atomic weapons from the AEC to the DOD.",0.161561
ddrs,1958-06-07,2007030101072,,0.160188
ddrs,1949-07-01,1979010100070,"[Union of Soviet Socialist Republics] Status of the U.S.S.R. Atomic Energy Project [new information on the possible method the Soviets are following suggests their first bomb will not be ready until mid-1951. Current estimates of the amount of uranium available indicate the Soviets could stockpile 150 atomic bombs by mid-1957]. Office of Scientific Intelligence, Nuclear Energy Branch, OSI/SR-10/49. July 1, 1949. 2 p. TOP SECRET. Declassified May 25, 1978. Truman Library, Papers of Harry S. Truman, President\'s Secretary\'s File.",0.16
ddrs,1966-06-12,2004090102981,"President Lyndon B. Johnson is provided with a daily report on the military situation in Vietnam. Issues include: report on a march by approximately 60,000 Catholics in Saigon in support of U.S., South Korean and Australian efforts to fight Communism in South Vietnam; information on U.S. and/or South Vietnamese operations EL PASO II and HAWTHORNE; status of U.S. reconnaissance missions over North Vietnam. Also included is the weekly casualty list of Viet Cong, South Vietnamese, U.S. and other Allied forces killed, wounded, or missing/captured, along with the cumulative figures from the first of the year and from the start of the conflict from 1/1/61.",0.159764
ddrs,1966-06-25,2004110103569,"President Lyndon B. Johnson is provided with a daily report on the military situation in Vietnam. Issues include: an update on U.S. and/or South Vietnamese operations PAUL REVERE and NATHAN HALE; status of U.S. reconnaissance and/or bombing missions over North Vietnam including railroad and highway bridges, the Dong Liet supply depot northwest of Vinh, and Ke Lui barracks north of Vinh. Also attached is the weekly casualty list of Viet Cong, South Vietnamese, U.S. and other Allied forces killed, wounded, or missing/captured, along with the cumulative figures from the first of the year and from the start of the conflict from 1/1/61.",0.159763
ddrs,1951-09-17,1978070100308,"United Kingdom and France, Reactions of the, to an Assumed Proposed Use of Atomic Weapons by the US [in spite of strong moral feelings about the use of atomic weapons, the UK would approve US use of A-bombs in response to Soviet attacks on North Atlantic Treaty powers but would oppose their use in the case of Soviet intervention with conventional weapons in Korea or attacks by Soviet satellites. France would also endorse use of A-bombs if NAT powers were attacked on the grounds that general war was inevitable and in the hope that damage to France could be kept to a minimum; otherwise, France would seek to keep conflicts in Korea, Yugoslavia, Japan, or Greece localized. Possible \""tactical\"" employment of atomic weapons against local fronts and immediate rear-area targets would be viewed with less anxiety by both France and the UK. Finally, US use of French and British bases for atomic warfare would depend on full consultation regarding specific uses of atomic weapons, or the system of military cooperation and alliance would collapse]. Office of Intelligence Research, OIR Report No. 5619. Sept. 17, 1951. 8 p. SECRET. Declassified Feb. 14, 1978.",0.159752
ddrs,1973-12-02,2007010100448,Draft of President Richard M. Nixon\'s statement announcing the creation of a Federal Energy Administration. This agency will be the principal department within the government for managing the policies and programs developed to meet the energy crisis and will be responsible for a number of programs presently scattered throughout the executive branch.,0.159697
ddrs,1950-06-09,2003050101211,Report of the Ad Hoc Committee on Atomic Energy Intelligence. This group\'s objectives include: the establishment of procedures to meet nuclear energy intelligence security requirements; estimation of the adequacy of these procedures; recommendations on how this improvement might be most economically achieved.,0.159614
ddrs,1954-08-19,1990070102311,Fourth draft of Eisenhower\'s 1954 Labor Day speech on peaceful uses of nuclear power.,0.158202
ddrs,1954-04-09,1998070101850,Draft memorandum by C.D. Jackson regarding J. Robert Oppenheimer (referred to as Scientist X). Jackson describes AEC Chairman Lewis L. Strauss\' actions regarding the removal of all atomic-related documents from Oppenheimer\'s library at Princeton and the cancellation of Oppenheimer\'s Q clearance.,0.158164
ddrs,1967-05-09,1999070101909,Memorandum from Cyrus Vance for President Lyndon B. Johnson requesting a continuance of the Strategic Air Command (SAC) alert indoctrination program for fiscal year 1968. Daily training missions enable SAC to maintain a ready airborne alert capability.,0.15812
ddrs,1966-08-27,2005010100569,"President Lyndon B. Johnson is provided with a daily report on the military situation in Vietnam. Issues include: an update on U.S. and/or South Vietnamese operations PRAIRIE, ALLEGHENY, and PAUL REVERE II; status of U.S. reconnaissance and/or bombing mis",0.157902
ddrs,1966-07-28,2005070102372,President Lyndon B. Johnson is provided with a daily report on the military situation in Vietnam. Issues include: an update on U.S. and/or South Vietnamese operations HASTINGS and PAUL REVERE; status of U.S. reconnaissance and/or bombing missions over Nor,0.157895
ddrs,1966-04-06,1980070100115,"[Vietnam and Vietnam War] Cover Letter, Stephen Enke, Dep. Asst. Secy of Defense, 27-April 2 [military engagements and casualties]. Memorandum, Arthur McCafferty, Briefing Officer, to the President. Apr. 6, 1966. 2 p. SECRET. Declassified Apr. 24, 1979. Johnson Library, NSF, Countries, Vietnam, Vol. 50.",0.157298
ddrs,1950-12-27,1983010101573,S.S.R.Status of the Soviet atomic energy program.,0.157249
ddrs,1951-11-29,1989070101801,"Principles controlling the classification of information as \""Restricted Data\"" under the Atomic Energy Act of 1946 detailed.",0.156998
ddrs,1957-07-02,1980070100174,"North Atlantic [Treaty Organization] Military Committee, Special Report to the 1823/333, p. 2222-2224, incl. Transmittal Notes, Joint Secretariat. July 2-18, 1957. 2 p. Att: Same title [because 280mm and 8-inch atomic shells are already available, a completely new capability with the 155mm howitzer should be developed. A large number of 155mm howitzers in Army active and reserve units and in allied armies with an atomic capability would have a far-reaching impact on enemy plans]. Memorandum, CSAM 78-57, Chief of Staff, Army, to the JCS. June 13, 1957. 2 p.; Encl: Same title [the Secy of Defense is asked to request that the AEC proceed \""expeditiously\"" with the development of a 155mm artillery shell]. Draft Memorandum, to the Secy of Defense. 1 p. SECRET to CONFIDENTIAL. Declassified Apr. 11, 1978. Released 1979.",0.156863
ddrs,1966-11-21,2000050101791,Cable to President Lyndon B. Johnson regarding confrontations between Allied and Communist forces in widespread sections of South Vietnam.,0.156599
ddrs,1973-10-23,2003090102923,"In a memorandum to Atomic Energy Commission (AEC) chairperson Dixy Lee Ray, President Richard M. Nixon approves the proposed amendment to the \""Agreement for Cooperation with Switzerland Concerning Civil Uses of Atomic Energy.\"" Attached are two versions of this correspondence.",0.154256
ddrs,1952-03-12,1983010100800,S.S.R.Report on the Soviet atomic energy program.,0.153846
ddrs,1966-06-21,2004090102987,"President Lyndon B. Johnson is provided with a daily report on the military situation in Vietnam. Issues include: information on Buddhist relations with police in South Vietnam; update on U.S. and/or South Vietnamese operations FILLMORE, HAWTHORNE, NATHAN HALE, DECK HOUSE, and KANSAS; status of U.S. reconnaissance missions over North Vietnam. Also included is the weekly casualty list of Viet Cong, South Vietnamese, U.S. and other Allied forces killed, wounded, or missing/captured, along with the cumulative figures from the first of the year and from the start of the conflict from 1/1/61.",0.153678
ddrs,1952-08-15,2001090102407,Atomic Energy Commission (AEC) chairman Gordon Dean proposes to conduct full-scale atomic weapon tests (Operation IVY) at the Pacific Proving Grounds in the fall of 1952.,0.153358
ddrs,1968-02-23,1997030101168,Memorandum for Gen. Taylor on U.S. Armed Forces strategic and ready reserve posture.,0.152942
ddrs,1959-11-05,1997050101445,"Memo to Hon. John Irwin, II from E. Fiske discusses anticipated reduction in U.S. funds for NATO military purposes.",0.152942
ddrs,1966-08-12,2005050101786,President Lyndon B. Johnson is provided with a daily report on the military situation in Vietnam. Issues include: an update on U.S. and/or South Vietnamese operations COLORADO and PAUL REVERE II; status of U.S. reconnaissance and/or bombing missions over ,0.152632
ddrs,1966-01-17,1991090102943,"WH briefing room prepares briefing for Johnson; topics include: B-52 and a KC-135 tanker collide during refueling operations 180 miles from Gibralter, nuclear disaster team dispatched to area; Viet Cong attacks on South Vietnam government installations.",0.152439
ddrs,1952-10-06,1987070102333,Outline of American atomic strategy in non-military fields.,0.152083
ddrs,1966-03-26,2003110103588,"President Lyndon B. Johnson is provided with a daily report on the military situation in Vietnam. Issues include: end of combined U.S.-South Vietnamese search and destroy Operation TEXAS/LIEN KET 28; results of military operations HARRISON, JACK STAY, TIGER V; status of armed reconnaissance missions in North Vietnam. Also included is the weekly casualty list of Viet Cong, South Vietnamese, U.S. and other allied forces killed, wounded, or missing/captured, along with the cumulative figures from the first of the year and from the start of the conflict from 1/1/61.",0.152011
ddrs,1954-02-04,1992010100240,DOS considers European tour of exhibit graphically portraying U.S.\'s peacetime use of atomic energy.,0.151841
ddrs,1966-06-30,2004110103573,"President Lyndon B. Johnson is provided with a daily report on the military situation in Vietnam. Issues include: an update on U.S. and/or South Vietnamese operations JAY and YORKTOWN; U.S. reconnaissance and/or bombing missions over North Vietnam, which include petroleum, oil and lubrication (POL) storage sites and military barracks. Also attached is the weekly casualty list of Viet Cong, South Vietnamese, U.S. and other Allied forces killed, wounded, or missing/captured, along with the cumulative figures from the first of the year and from the start of the conflict from 1/1/61.",0.151516
ddrs,1966-05-04,2004090102978,"President Lyndon B. Johnson is provided with a daily report on the military situation in Vietnam. Issues include: update on U.S. and/or South Vietnamese operations MAILI, GEORGIA, and MOSBY II; status of U.S. reconnaissance missions over North Vietnam. Also included is the weekly casualty list of Viet Cong, South Vietnamese, U.S. and other Allied forces killed, wounded, or missing/captured, along with the cumulative figures from the first of the year and from the start of the conflict from 1/1/61.",0.150944
ddrs,1980-10-20,1997090102493,"Memo from Lynn R. Coleman to Zbigniew Brzezinski on a proposal by Secretary of Energy Charles W. Duncan, Jr. for an energy-oriented trip to China.",0.15074
