collection,date,id,title,topic_score
ddrs,,1998050101342,Public safety situation and U.S. fiscal years 1967 and 1968 budget requirements for Latin America. Countries include: Bolivia; Colombia; Dominican Republic; Ecuador; Guatemala; Peru; Venezuela.,0.149173
ddrs,,1994030100651,Status of 21 recommendations made by JCS following their trip to Vietnam.,0.14861
ddrs,1966-12-01,1982010102040,Charter for office of civil operations of the U.S. mission; purpose of which is to support Vietnamese Revolutionary Development effort.,0.14846
ddrs,1960-10-21,1988090102774,Outline of considerations and objectives involved in achieving closer integration of foreign intelligence activities within the DOD.,0.147613
ddrs,1954-05-14,1992010100486,"Principles to assure coordination of \""gray\"" activities, those activities including propaganda which can not be attributed to U.S. government.",0.147059
ddrs,1956-11-06,1993050101370,U.S. policy relative to commitments to foreign governments under foreign assistance programs.,0.147059
ddrs,1953-08-24,2003010100528,Two versions (draft and final copy) of President Dwight D. Eisenhower\'s memorandum to National Security Council (NSC) executive secretary Hugh Farley regarding the abolishment of the Psychological Strategy Board (PSB) and the establishment of the Operations Coordinating Board (OCB) in its place.,0.147059
