collection,date,id,title,topic_score
ddrs,,1975100100063,"Japan\'s Eight Point Economic Program: Progress and Prospects [in June 1971 Prime Minister Sato announced an eight point program designed to liberalize Japan\'s trade and foreign capital investment policies. Effectiveness of the program still to be determined; overall liberalization will proceed slowly; removal of remaining formal restrictions will be difficult, as they protect important Japanese industries; also 10% US surcharge and rise of yen in terms of dollars will slow pace of liberalization. Top Japanese Govt. officials may use program as leverage to remove US 10% surcharge; but most unlikely program will be halted]. Directorate of Intelligence Memorandum, Office of Economic Research, ER-IM 71-178. Sept. 1971. 10 p., tables. CONFIDENTIAL/ NO FOREIGN DISSEM. Declassified Aug. 13, 1975.",0.0680286
ddrs,1956-08-09,2000030101071,National Security Council Report on CIA responsibilities for the implementation of a study on techniques and weapons technology for peripheral wars.,0.0677978
ddrs,1970-06-09,2006070102188,"Report of the President\'s Task Force on Air Pollution entitled: \""Cleaner Air for the Nation.\"" The mission of this Task Force is to review present actions of the public and private sectors to minimize air pollution and to recommend what might be done in the future.",0.0676825
ddrs,1951-02-10,1977010100097,"Defense Against Soviet Medical Interrogation and Espionage Techniques (description of Soviet uses of \""drugs, hypnotism, hypnonarco-analysis, electric and drug shock, and possibly the use of ultrasonics; effectiveness of methods; special cases; possibility of uses in Soviet trials). Report, unattributed. Feb. 10, 1951. 3 p. SECRET. Declassified date not given.",0.0667855
ddrs,1957-12-16,1992090102929,Scheduled OCB 12/18/57 meeting on consideration of possible actions in the weapons and technological field.,0.0666916
ddrs,1954-08-31,1999090102560,"Charles H. Taquey favorably assesses a Working Group special study on India, but suggests more information be obtained on Communist infiltration in that country.",0.0666672
ddrs,1950-12-04,1975010100107,"Over-all Statement of Problem Involved [JCS views on a State Dept. position paper re British Prime Minister Attlee\'s forthcoming visit to US: immediate situation facing UN forces in Korea, US policy re Formosa, effect of US commitments in Far East on European defense efforts and economy, necessity for negotiations with USSR, opposition to a UN seat for Chinese Communists]. Report by the Joint Strategic Survey Committee to JCS. JCS No. 2176/1, pages 4-12 only. Dec. 4, 1950. Encl. A. [JCS views]; Encl. B. [State Dept paper.] 9 p. SECRET. Declassified Aug. 12, 1974.",0.0664663
ddrs,1961-01-18,2010010100085,,0.0663716
ddrs,1959-12-09,2001070102274,Intelligence report on Soviet propaganda methods for its outer space projects and programs from August-November 1959. Issues include: moon probes; earth satellites; manned space flights. ,0.0662156
ddrs,1956-11-15,1992010100511,Draft suggestions for paragraphs 15 through 19 of the Courses of Action for the Outline Plan.,0.0661743
ddrs,1957-02-19,1988030100802,"Objectives of visit of French Prime Minister Guy Mollet, 2/26-2/27/57.",0.066116
ddrs,1968-10-16,1994030101166,Summary of the Vance-Read telephone report 10/16/68 on the U.S. insistance that the GVN be present at peace negotiation sessions the day after bombing cessation.,0.0661157
