collection,date,id,title,topic_score
ddrs,1964-03-08,1977040100369,"(Tanganyika. UK security forces will leave Tanganyika and be replaced \""by a battalion from another African country\""; UK-Tanganyikan military talks indicate that Tanganyika is stepping away from East African integration and federation.) Am Emb Dar-es-Salaam, Telegram No. 1442. Mar. 8, 1964. 2 p. CONFIDENTIAL. SANITIZED copy. Released Aug. 25, 1976. Johnson Library, NSF, Countries, Tanganyika, Vol. 1.",0.145985
ddrs,1966-09-16,1990110103133,Recognition of Botwana and Lesotho and establishment of embassies discussed.,0.145984
ddrs,1966-09-16,1989070102023,Secretary Rusk recommends that the U.S. recognize the Republic of Botswana and the Kingdom of Lesotho upon their independence.,0.145952
ddrs,1977-05-12,2000090102949,"Vice President Walter Mondale reports to President Jimmy Carter on his meeting with Somalian Ambassador Addou regarding Soviet pressure for Somalia to accept Ethiopia\'s existing borders, and a request for U.S. economic and military assistance to reduce Soviet presence in the area.",0.145834
ddrs,1980-02-25,1999050101514,Memorandum from Secretary of State Cyrus R. Vance for President Jimmy Carter regarding Somalian eligibility to purchase U.S. defense articles and services under the Arms Export Control Act.,0.145101
ddrs,1963-07-11,1976010100010,"(Nuclear weapons) Non-Proliferation (U) (discussion of the possibilities specific achievement was the signature of the Charter of the Organization of African Unity by 30 chief executives; Africans are discussing with a new sense of urgency such practical steps as raising funds to accelerate liberation movements by violence and guerrilla action; the Africans are still far from unified, and are acutely aware of the divisions that beset Africa, of the critical need for continued assistance from the West, of the difficulties of raising and financing liberation forces, and of the danger of another Congo-like situation; well-organized campaigns against the whites in southern Africa are still some distance in the future). Office of National Estimates Memorandum. July 11, 1963. 13 p. SECRET. Declassified Apr. 27, 1976.",0.143547
ddrs,1979-10-20,2008050101245,Intelligence assessment on tribalism in Somalia and its threat to the government of President Mohammad Siad.,0.143399
ddrs,1965-04-30,1977010100039,"(China, People\'s Republic of) Peiping\'s Views on \""Revolutionary War\"". (China has little influence on the few Communist Parties in Africa with exception of the Communist Party in Senegal. China considers Brazzaville as one of its major bases of operations and has trained leaders and provided aid. Mali views China\'s aid and example as particularly suited to its needs. Ghana is considered a base for exporting \""revolution\"" to Africa; China has provided aid and guerrilla warfare specialists. Algeria has accepted aid but may be concerned over China\'s anti-US, anti-USSR tactics. China has close contact with the radical elements of the Tanzanian government. Kenya, Egypt, and Dahomey are wary of Chinese intentions in Africa). Directorate of Intelligence Memorandum, OCI No. 1211/65. Apr. 30, 1965. 24 p., maps, charts. Security classification not given. SANITIZED copy. Released Apr. 5, 1976.",0.143139
ddrs,1964-02-07,1995110103199,Background paper for U.S. visit of British Prime Minister Douglas-Home: East Africa and Zanzibar.,0.14313
ddrs,1961-06-01,1982010102601,"U.S. Consul Gibson summarizes internal situation in Angola, suggests U.S. action.",0.143114
ddrs,1964-03-12,1978010100241,"Africa, Southern, Problems of [the geopolitics of Africa: review of factors explaining and Chairman, Policy Planning Council, to Planning Group Members. Mar. 12, 1964. 1 p. Encl: Same title [description of the evolution of US policy on African cooperation; creation and organization of the OAU, consideration of the OAU and the questions of sovereignty, African solidarity, noninterference, assassination and subversion, tribal rivalries, North Africa, Algeria-Morocco boundary dispute, Somali-Ethiopian crisis, Rwanda-Burundi problem, Kenya-Somalia dispute, Portugal, South Africa, African Liberation Committee, recognition of new govts., Casablanca and Monrovia groups, and the Afro-Malagasy Union]. Report, Fred L. Hadsel and George B. Sherry, Bureau of African Affairs. Mar. 10, 1964. 30 p. Att. to Encl: [Chronological listing of OAU meetings and meetings of specialized commissions.] 1 p. CONFIDENTIAL. Declassified June 7, 1976. Johnson Library, NSF, Countries, Africa, General, Vol. 1.",0.142618
ddrs,1965-07-02,2005090102479,"Intelligence report entitled: \""Zambia and Its Refugee Nationalist Problem.\"" Issues include: refugee organizations and their backers; Zambian President Kenneth Kaunda\'s control over procedures for handling refugees; refugee activities which circumvent Kaun",0.142484
ddrs,1966-01-08,2005090102480,"Intelligence memorandum entitled: \""Implications of Rhodesian Independence for a Moderate and Stable Government in Zambia.\"" This document assesses the impact of Rhodesia\'s unilateral declaration of independence upon Zambian President Kenneth Kaunda\'s polic",0.142159
ddrs,1961-04-27,1983010100469,Tunisia\'s relations with the African states analyzed.,0.141936
ddrs,1967-10-19,1990030100604,Analysis of Soviet and Chinese Communist attempts at subversion in Africa.,0.141749
ddrs,1967-06-08,2011110103141,Tables listing the release of U.S. military supplies either through grants or Foreign Military Sales (FMS) to the following countries: Iraq; Tunisia; Morocco; Libya; Saudi Arabia; Jordan; Lebanon; Israel.,0.141738
ddrs,1964-03-03,2011090102556,Office of Research and Analysis for Africa director Robert Good provides some observations on the status of Communist activities in Africa.,0.141474
ddrs,1961-12-08,1978010100407,"Togo, Preliminary Analysis of Reported Assassination Plot in [assessment of Togo-lese report of a Ghanaian-supported assassination attempt against President Olympio; activities of the Union Democratique des Populations Togolaises; Ghanaian desire for integration of Togo with Ghana; significance of the Ewe tribe reunification issue; Togolese and Ghanaian offers of asylum to each others\' political exiles]. Research Memorandum, RAF-15, Robert C. Good, Dir., Office of Research and Analysis for Africa, Bureau of Intelligence and Research, to C. Vaughn Ferguson, AFW. Dec. 8, 1961. 4 p. SECRET. NO FORN. Declassified date not given.",0.141257
